headline,category
"Anushka Sharma Candidly, Thoroughly, PERFECTLY Called Out Bollywood's Sexism",clickbait
21 Badass Things Bollywood Did In 2015,clickbait
Could You Actually Quit Facebook,clickbait
Meet The Inspiring Plus-Size Pole Dancer,clickbait
Senator Says He Had Affair With an Aide,notclickbait
We Can Determine If You're A Good Driver Or Not In Three Questions,clickbait
This Toddler's Instagram Photos Are Guaranteed To Make You Feel,clickbait
Portuguese government resigns,notclickbait
15 Boozy Cake Pops To Up Your Dessert Game,clickbait
Defense Chief Criticizes Bid to Add F-22s,notclickbait
Here's What The Universal Monsters Would Look Like Today,clickbait
17 Drag Queen Transformations That Will Blow Your Mind,clickbait
Pigskin A Blanket: NFL Week 2 Picks,clickbait
"With Goals Tougher to Make, Rules Change on Bonuses",notclickbait
55 people die in Casablanca mattress factory fire,notclickbait
Ashes Teams Gasp for Breath,notclickbait
15 Dogs Who Are Having Their Greatest Birthday Ever,clickbait
"Identities of Bodies Found on Mesa Emerge, but Killer Remains Cloaked",notclickbait
17 Images You Won't Be Able To Unsee,clickbait
14 Comics That Capture Your Magical Gay Experience,clickbait
Are You More James Bond Or Austin Powers,clickbait
Five Irish schoolgirls die in bus crash,notclickbait
This Guy Celebrated A Bachelor Party Alone After The Rest Of The Wedding Party Got Stranded,clickbait
"Michael J Fox And Christopher Lloyd Crashed ""Jimmy Kimmel Live"" As Marty McFly And Doc Brown",clickbait
"Stephen Colbert Went Full ""Hunger Games"" Last Night",clickbait
The Try Guys Learn And Perform Iconic K-Pop Dances,clickbait
Beijing Investigates Transplants for Tourists,notclickbait
Last Minute Halloween Costume Ideas For Your Pet,clickbait
Tell Us How You Started Your Big Weight Loss Journey,clickbait
Zimbabwe cancels education year for 4.5 million after political and economic troubles,notclickbait
19 Small Awards Anyone With Anxiety Deserves To Receive,clickbait
"Italy Agrees to Take Migrants, Ending Standoff With Malta",notclickbait
California state legislature passes same-sex marriage bill,notclickbait
Australian Marcos Ambrose Is Rising Nascar Star,notclickbait
Did You Ruin Everything,clickbait
Radioactive leakage at Swedish nuclear waste store,notclickbait
Los Angeles City Council to sue police officer accused of filing a false report,notclickbait
Two Young Actors Give The Year's Most Heartachingly Mature Performances,clickbait
"In Zimbabwe, Deal Likely to Fly or Fail This Week",notclickbait
"Are You More ""In The Heights"" Or ""Hamilton""",clickbait
U.S. government proposes removing Yellowstone grizzlies from endangered species list,notclickbait
"In Book, Radomski Talks About Dealing Drugs and Dealing With Mitchell",notclickbait
"Boat in Bangladesh sinks, at least twelve dead",notclickbait
13 Weirdly Random Things Indians Have Uploaded To Porn Sites,clickbait
At least thirty-three more dead in Ethiopia election clashes,notclickbait
11 Reasons Leslie Knope Is The Queen Of Compliments,clickbait
What Does Your Choice Of Whiskey Say About You,clickbait
These Valentine's Day Stories Prove That It's Maybe The Worst Day Of The Year,clickbait
U.S. Senate approves revised bailout package after controversial additions,notclickbait
21 Kitchen Gadgets That Actually Help You Eat Healthier,clickbait
Which 2009 Pop Hit Are You,clickbait
30 Things You Need To Cook In November,clickbait
Neil Patrick Harris And David Burtka Made Their Kids An Adorable Sandcastle Cake,clickbait
23 Beautiful Cakes That Will Make Your Dreams Come True,clickbait
New York City Mayor Michael Bloomberg spent US$108 million on third term bid,notclickbait
People Who Don't Swear,clickbait
Caitlyn Jenner Totally Slayed It At The Point Foundation's Annual Voices On Point Gala,clickbait
Asexual People Answer Questions You Have,clickbait
Two Twin Brothers Separated Since World War II Have Finally Been Reunited,clickbait
It's Time To Talk About How The Recast Dumbledore Was Literally The Worst,clickbait
16 Adults Reveal Their Hilarious Stories About The Last Time They Peed Themselves,clickbait
Is This A Close Up Of Eggnog Or A Handful Of Mayonnaise,clickbait
"Can You Match The ""BoJack Horseman"" Quote To The Character",clickbait
$8 Million Award in First Solo Tobacco Trial,notclickbait
Biology and Technology Intersect to Create Art,notclickbait
Tour de France: Yellow jersey Rasmussen withdrawn,notclickbait
This Touching Photo Of A Bride And Her Service Dog Is Going Viral,clickbait
"Marshall Eriksen's Best 25 Quotes On ""How I Met Your Mother""",clickbait
Chinese human rights activist faces trial,notclickbait
Final report blames London passenger jet crash on ice,notclickbait
9 Celebrities As Zombies And Some Undead Fiction,clickbait
"American disc jockey ""DJ AM"" dies at 36 of suspected drug overdose",notclickbait
"The Dark Knight film director's brother arrested for murder, kidnapping",notclickbait
"Harlan Ellison sues CBS-Paramount, WGA over Star Trek royalties",notclickbait
Does Black Ever Crack? -- Guess These Black Celebs Ages,clickbait
32 Pictures That Perfectly Sum Up Your Elementary School Experience,clickbait
African nations gather to support a ban on cluster bombs,notclickbait
26 Products For People Who Are Completely Obsessed With Snakes,clickbait
"Thousands Of People Are Sharing This ""Humans Of Bombay"" Post About A Child With A Rare Genetic Disorder",clickbait
This Is What Disney Princesses Would Look Like In Real Life,clickbait
Who Said It: The Disney Insult Edition,clickbait
"Watch What Happens When Teens React To ""Back To The Future Part II""",clickbait
How Many Of These Defunct English Football Grounds Have You Been To,clickbait
Libertarian National Committee in fierce deadlock over how to address growing Bob Barr controversies,notclickbait
"After uncertain day of Eurovision rehearsals, EBU will place sanctions on Spain and RTVE",notclickbait
"State of emergency declared in Kingston, Jamaica",notclickbait
Bomb in Dagestan explodes Russian military truck,notclickbait
Happy Gilmore Was On to Something,notclickbait
Russia assumes leadership of G8 for 2006,notclickbait
How Well Do You Remember These PlayStation Games,clickbait
Try And Guess What Halloween Candies These Were Before We Smashed Them,clickbait
"14 ""Hunger Games"" Questions That Are Impossible To Answer",clickbait
Man buys his stolen camera on eBay,notclickbait
Union Head Says Investigating Agents Is a Difficult Task,notclickbait
Russia expels four UK diplomats,notclickbait
Relax And Watch This Hamster Eat A Little Carrot,clickbait
19 Things You Can Only Say During Sex If You're Emo,clickbait
False cancer cure claims lead to federal charges against five US companies,notclickbait
Iran building collapse kills 19,notclickbait
17 Twentysomething Problems Summed Up By Houseplants,clickbait
Groundhogs Aren't The Only Animals Who Can Predict The Future,clickbait
"Subway train derails in Washington, D.C.",notclickbait
Increased tension in border dispute between Eritrea and Ethiopia,notclickbait
Are You More D.J. Tanner Or DJ Khaled,clickbait
Father throws 4-year-old daughter from bridge,notclickbait
Which Cool Outer Space Shit Are You Based On Your Zodiac Sign,clickbait
13 Very Honest Confessions From People Having A Quarter-Life Crisis,clickbait
Computer Science Programs Make a Comeback in Enrollment,notclickbait
Suicidal man pushed off Chinese bridge,notclickbait
9 Confessions That Will Make You Glad You're Single,clickbait
"Knicks Rout Grizzles, Extending Win Streak to Three Games",notclickbait
21 people killed and 113 reported injured in three blasts in Mumbai,notclickbait
Which Type Of Swearer Are You,clickbait
Can We Ask You A Really Weird Question,clickbait
18 Fall Salads You Need In Your Life Right Now,clickbait
Day 4 Of BuzzFeed's 7-Day Clean Eating Challenge,clickbait
"The Fish Are Biting, and the Room Is Hopping",notclickbait
"Nearly 25,000 Iraqi civilians killed in Iraq, watchdog group claims",notclickbait
Liz Claiborne Looks for a Mizrahian Lift,notclickbait
Can Americans Pass The UK Driving Test,clickbait
"Which ""Star Wars"" Spaceship Should You Fly",clickbait
Jenson Button wins 2009 Bahrain Grand Prix,notclickbait
"The Lake Wobegon Effect, in Actively Managed Funds",notclickbait
India's ruling Congress party leads in three key state polls,notclickbait
25 Of 2015's Highest-Paid Musicians According To Forbes,clickbait
"11 Questions Every ""Doctor Who"" Fan Has, Answered By Steven Moffat",clickbait
"How To Be A Broadway Diva, Or At Least How To Fake It",clickbait
Why Umbrellas Are Just The Worst,clickbait
21 Absolutely Fucking Perfect Moments In Sporting Caption History,clickbait
Next Big Film Has a Premiere in Your Living Room,notclickbait
21 Times Red Forman Was The Realest Fucker On The Planet,clickbait
"Which Hogwarts Houses Do The ""PLL"" Characters Belong In",clickbait
Japanese stocks continue to fall after earthquake,notclickbait
How Lazy Are You Being Today,clickbait
UK experiences first widespread snow of 2009,notclickbait
US satellite radio provider Sirius unveils portable player,notclickbait
The King's Speech wins People's Choice Award at 2010 Toronto Film Festival,notclickbait
Watch This Out Gay Marine Ask Singer Steve Grand To The Marine Corps Ball,clickbait
These Are The 2016 Books Readers Are Most Pumped For,clickbait
These DIY Magnetic Jar Holders Will Save You So Much Cabinet Space,clickbait
"Five children found dead in Graham, Washington",notclickbait
Amy Schumer And Amy Poehler Were Perfect Together At The Emmys,clickbait
Officer dies after accident in President Bush's motorcade,notclickbait
Tornado jet crashes in Scotland,notclickbait
60 reported dead in Congo train crash,notclickbait
Terror suspects arrested in connection with bombing public bus in Israel,notclickbait
Try Stuffing Chicken Parmesan Meatballs With Mozzarella And See What Happens,clickbait
Toyota recalls up to 1.8 million automobiles,notclickbait
24 Times Nathan Fillion Was The Funniest Thing On Twitter,clickbait
Same-sex marriage reaffirmed in Canada,notclickbait
21 Stores You'll Love If You Are Addicted To Urban Outfitters,clickbait
"Olivia From ""The Bachelor"" Made It Off That Beach They Left Her On",clickbait
"Pittsburgh Pirates defeat Philadelphia Phillies, 3-0",notclickbait
EU's human rights court endorses Turkish headscarf ban,notclickbait
Teens sought in Pennsylvania killings found,notclickbait
We Played With Bizarre Sex Toys So You Don't Have To,clickbait
15 TV Shows And Movies That Came Back From The Dead In 2015,clickbait
Let These Hot Guys Help You Count Down The Days 'Til Christmas,clickbait
We Know Your Best Quality Based On Random Questions,clickbait
Cities Deal With a Surge in Shantytowns,notclickbait
Woman in Binghamton Athletics Files Harassment Complaint,notclickbait
This Is What Happens When A Blizzard Strikes On Your Wedding Day,clickbait
UN High Commissioner for Human Rights: close Guantanamo Bay,notclickbait
Can You Guess What Happens When You Try To Eat 50 McDonald's Nuggets In 5 Minutes,clickbait
"How Well Do You Remember ""Freaky Friday""",clickbait
Nokia takes over Symbian OS development,notclickbait
O. J. Simpson sentenced to 15 years in prison,notclickbait
Owner of Segway Jimi Heselden dies after scooter cliff fall aged 62,notclickbait
Mozart In The Jungle Should Be The Next Show You Binge-Watch,clickbait
Wikinews interviews author and filmmaker John Gaspard,notclickbait
Which Video Game Princess Are You,clickbait
17 Things People Don't Understand About OCD,clickbait
Russian oil depot burning after explosion,notclickbait
Meet The Girl Who Buttchugged Cough Syrup,clickbait
Your Chance to Show What the Super Bowl Logo Should Look Like,notclickbait
Executions Debated as Missouri Plans One,notclickbait
Can You Identify The 2015 Music Video By Its YouTube Comment,clickbait
This Is What Happens When Your Abuela Tries To Speak English,clickbait
Dima Bilan wins the 2008 Eurovision Song Contest for Russia,notclickbait
Have You Had A Real-Life Meet-Cute,clickbait
Which Disney Character Sparked Your Sexual Awakening,clickbait
Can You Name The John Green Book By Just The Cover Art,clickbait
Six H1N1 cases appear in the Philippines,notclickbait
United States Senator Lieberman to speak at Republican party convention,notclickbait
Ad Losses Put Squeeze on TV News,notclickbait
"Rangers Pick Up Where They Left Off, With a Victory",notclickbait
Which Classic Movie Should Your Intro To Film Essay Be About,clickbait
Vatican releases statement on health of Pope,notclickbait
"Meet Dhee, Bangladesh's First Lesbian Comic Book Character",clickbait
HP France in trouble due to alleged monopolist behavior,notclickbait
34 Eye Opening Photos Of The Great Depression,clickbait
"Acquired in J. J. Putz Trade, Sean Green Also Seen as Valuable to Mets",notclickbait
"Football Aside, Tom Brady Takes Some Really Cute Dad Pics",clickbait
Thousands protest privatisation of Australian electricity industry,notclickbait
"Redskins Sign Haynesworth, but They Pay Top Dollar",notclickbait
Jennifer Lawrence's New Movie Is Basically Just A Bunch Of GIFs Of Her In Search Of A Movie,clickbait
Service Warranties and the Cost of Fun,notclickbait
"British seaman appears in court, charged with murder after shooting on nuclear submarine",notclickbait
"Remember When David Bowie Was On ""SpongeBob Squarepants?""",clickbait
"In Gaza, Weighing Crimes and Ethics in Urban Warfare",notclickbait
"Matthew Edwards, honored Michigan police officer, shot and killed",notclickbait
18 Cats Who Don't Believe In Books,clickbait
Sharapova knocked out of Wimbledon 2005 in semi-final,notclickbait
Indonesian parliament approves privatising of three major state firms,notclickbait
14 People Describe The Exact Moment They Realised They're In Love,clickbait
"With Surgery Done, Alex Rodriguez to Begin Rehab Immediately",notclickbait
US East Coast prepares for blizzard,notclickbait
U.S. Scrambles for Information on Iran,notclickbait
180 Hidden Miles of Great Wall of China Found,notclickbait
Japan earthquake shifts Earth's axis 10 centimetres,notclickbait
POLL: Which Female Celebrity Owned 2015,clickbait
"Gordon Brown: Extra troops for Afghanistan, Yemen security the focus for int'l conference",notclickbait
19 Things That Happen When Your Song Comes On In The Club,clickbait
Everybody Hates Mark From Match.com,clickbait
12 Confessions From People Who Struggle With Anxiety,clickbait
Tinder Just Added An STI Testing Locator To Their Website,clickbait
Mubarak summoned by Egyptian prosecutors to face allegations of killings and corruption,notclickbait
France Opens First Military Bases in the Gulf,notclickbait
8 Ways To Use Bi Invisibility To Your Advantage,clickbait
17 Pictures Hot People Will Never Understand,clickbait
Canberrans spend Easter outside: in pictures,notclickbait
21 Signs You're Addicted To Your Goddamn iPhone,clickbait
Take A Look Back At The Biggest Black Friday Toys Of The Past 20 Years,clickbait
US President Barack Obama speaks at memorial for Arizona shooting victims,notclickbait
Knife Attack Kills 3 at Belgian Day Care Center,notclickbait
British jazz musician John Dankworth dies aged 82,notclickbait
Pirates seize cargo ship in Indian Ocean,notclickbait
How ~Deep~ Are You,clickbait
Nine Killed as Tornado Rakes Oklahoma,notclickbait
23 Things You'll Only Relate To If You're Slightly Obsessed With Makeup,clickbait
Latvian government takes majority stake in Parex Bank,notclickbait
65 Things That Make British People Feel Slightly Guilty,clickbait
Indiana businessman held hostage in Iraq,notclickbait
South Africa Bars Dalai Lama From a Peace Conference,notclickbait
23 Annoying Things That Will Happen For The Rest Of Your Life,clickbait
14 Duets That Prove Two Voices Are Better Than One,clickbait
19 Reasons The Nintendo 64 Is The Greatest Console Of All Time,clickbait
Keeping True Identity Online Becomes Battle,notclickbait
U.N. Report Lays Out Options for an Oil-Rich Iraqi Region,notclickbait
"Are You More Harry Or Marv From ""Home Alone?""",clickbait
Major storms batter Europe,notclickbait
19 Cat Reactions For Every Thanksgiving Situation,clickbait
Australian Football League to hold match in China,notclickbait
Country Star Jason Aldean Wore Blackface On Halloween To Dress Up As Lil Wayne,clickbait
"17 ""Home Alone"" Tweets That Will Make You Laugh Out Loud",clickbait
Crisis Reshaping Wall St. as Stars Begin to Scatter,notclickbait
This Is What Someone With Anxiety Actually Hears,clickbait
Only True New Jerseyans Will Ace This Quiz,clickbait
People Are Using The Hashtag #BurritoSelfie And It Is As Glorious As You'd Imagine,clickbait
Canada commits C$127.4 million to fighting tuberculosis,notclickbait
Dick Cheney makes surprise Iraq visit,notclickbait
Who Said It: Taylor Swift Or Dr. Phil,clickbait
Qatar Said to Be Pondering a Stake in Porsche,notclickbait
A New BlackBerry Curve Loaded With Features,notclickbait
"The New Trailer For ""The Secret Life Of Pets"" Is Here And It's Adorable",clickbait
Balancing Freedom and the Role of the State in Germany,notclickbait
"This Cover Of AC/DC's ""Thunderstruck"" On Bagpipes Is Fierce AF",clickbait
Can You Help People Find This Kid So They Can Give Him A Real Messi Shirt,clickbait
What Percent Single Are You,clickbait
Survivors of High-Seas Drama Return to France,notclickbait
We Know Your Favorite Disney Movie Based On Your Favorite Dog,clickbait
A Bunch Of Women Wore Pants To The Emmys And It Was Perfect,clickbait
This Guy Proposed With A Custom Super Mario Brothers-Style Video Game,clickbait
Which Rihanna Album Are You Actually,clickbait
US Senate advances health care reform bill,notclickbait
"Amid Crackdown, Iran Admits Voting Errors",notclickbait
How A Decade Of Sobriety Finally Taught Me To Drink,clickbait
Even Well-off Consumers Aim to be Less Conspicuous,notclickbait
U.S. jury deliberates immigrant smuggler case,notclickbait
Scientists develop 'Smart Bomb' treatment that targets cancer cells,notclickbait
Zeinab Sadiq Jaafar,notclickbait
29 Celebrities In 2006 Compared With Now,clickbait
Science of champagne bubbles explained,notclickbait
9 Things You'll Definitely Lose In 2016,clickbait
Bolivian president announces legal action over Obama's 'crimes against humanity',notclickbait
Refugees From Region in Pakistan Trickling Home,notclickbait
Scientists create micro-battery using 3D printing,notclickbait
24 Hilarious Tweets About Kids That Are Way Too Real For Every Parent,clickbait
"Hospital in Essex, England fined £50,000 after patient dies due to health and safety breaches",notclickbait
Chris Moyles Is Returning To Radio With A Breakfast Show On Radio X,clickbait
William Morris and Endeavor Explore a Merger,notclickbait
Protesters clash with police as Bush visits London,notclickbait
We Know What Movie Makes You Cry,clickbait
17 Ways To Procrastinate At Work Without Getting Caught,clickbait
"This Kid Stopped On His Way To Second Base To Tell His Baseball Coach ""I Love You""",clickbait
"From Blog to Print, Laughing All the Way to the Bank",notclickbait
"Your Self Care Routine Should Include BuzzFeed's ""Another Round"" Podcast",clickbait
High-Tech Device Thumps Course to Test Its Firmness,notclickbait
"Try To Stay Calm '90s Kids, But The ""Full House"" House Is Being Reconstructed",clickbait
"Worried About Flu, China Confines U.S. Students",notclickbait
Jets Hope N.F.L. Draft Helps Rebuild Offense,notclickbait
"Orange County bus strike ends as union, board approve contract",notclickbait
"23 Times Andy Dwyer From ""Parks & Rec"" Was Wrong About Everything",clickbait
"Jessie J Sang Little Mermaid's ""Part Of Your World"" And It's Insane",clickbait
23 Pictures That Will Make All Responsible Adults Extremely Angry,clickbait
Bigoted woman: controversial Gordon Brown remarks caught on air,notclickbait
Hurricane Wilma still a Category 5 threat,notclickbait
"I'm Queer, The Mormon Church Doesn't Want Me, But I'm Staying",clickbait
BuzzFeed Writers Try To Do Handstands,clickbait
This Video Of A Grandpa Singing To His 93-Year-Old Dying Wife Will Give You All The Feels,clickbait
Wikimania jury chooses Buenos Aires for 2009 location,notclickbait
"$8,000 Phobos Media Center Comes With a Tech",notclickbait
Obama succeeds Bush as 44th president of the United States,notclickbait
Pakistani Reporter Is Killed After Rally for Taliban Truce,notclickbait
Usain Bolt sets new world record in 100m sprint,notclickbait
How Much Do You Actually Know About Ancient Technology,clickbait
22 Confessions From Erotica Writers,clickbait
"Time magazine's 2006 Person of the Year is ""you""",notclickbait
35 Costumes Guaranteed To Win Halloween,clickbait
Moore Scores 40 and Sets Marks for No. 1 UConn,notclickbait
Much of UK placed on flood alert by Met Office,notclickbait
First Libertarian Party presidential nominee John Hospers dies at 93,notclickbait
"Which ""Percy Jackson"" Demigod Are You",clickbait
"Here Is ABC Family's ""Hocus Pocus"" Schedule For Halloween",clickbait
A Top Sunni Survives an Attack in Iraq,notclickbait
S.E.C. Nominee Offers  Plan for Tighter Regulation,notclickbait
28 Tweets That Sum Up What It's Like To Grow Up In New Jersey,clickbait
These Google Calendar Tricks Will Get You Organized,clickbait
German football: Lahm's contract offer withdrawn; Schlaudraff to Hannover,notclickbait
When You're A Girl With A Dirty Mind,clickbait
"Africa makes first draft version of UNCCC treaty, with harder goals",notclickbait
Can You Really Tell The Difference Between Elena Gilbert And Katherine Pierce,clickbait
'Pregnancy pact' grabs international attention for small Massachusetts town,notclickbait
DNA components found in meteorites,notclickbait
17 Books You Definitely Read If You Grew Up In The '00s,clickbait
Google prepares to launch WiFi service,notclickbait
Here's Why You Actually Get Depressed In The Winter,clickbait
Explosion in Russia kills 10: authorities suspect Chechen involvement,notclickbait
Here's How Bollywood Dressed Up For Halloween,clickbait
Did You Peak In 2015,clickbait
"Human trafficking trial starts in Clearwater, Florida",notclickbait
What Are Your Best Tips For Keeping The Weight Off,clickbait
Iraq Leader Omits a Bit in Lauding U.S. Pullout,notclickbait
San Francisco hit-and-run suspect caught after lying,notclickbait
17 Gifts For People Whose Best Friend Is A Pomeranian,clickbait
India's Telecom Authorities Just Called Mark Zuckerberg's Bluff About Free Basics,clickbait
Montreal lab questions ethics of recent EPO doping claims against Lance Armstrong,notclickbait
How To Cook A Real Feast Of The Seven Fishes,clickbait
"North, South Korea plan united team for 2008 Olympics",notclickbait
These Straight Men Asked Gay Men Questions About Life And Sex,clickbait
18 Of The Most Cringeworthy Lyrics From 2015,clickbait
19 Painful Photos Every Short Guy Can Relate To,clickbait
21 Videos Of Eggs That Are Actually Porn,clickbait
17 Relationship Goals That Are Actually Worth Achieving,clickbait
UNESCO votes in favor of Palestine membership,notclickbait
"Fuck, Marry, Kill: Same Actor, Different Characters",clickbait
Manitoba residents receive evacuation flood alerts,notclickbait
Bomb blasts kill several in Iran,notclickbait
"The Cast Of ""Maze Runner"" Imitated Dylan O'Brien On The Red Carpet",clickbait
17 Struggles Every Clean Roommate Knows To Be True,clickbait
"At the Open, Rain Tops the Leader Board",notclickbait
"On Hot Day, a Dash of Spice at Palmer Invitational",notclickbait
"Poker's all about luck, says Swiss Supreme Court",notclickbait
Embassies across London lower their flags in honour of Nelson Mandela,notclickbait
Can You Guess The Avril Lavigne Video From One Screenshot,clickbait
Emojis: What The Fuck Do They Mean,clickbait
"UK government to spy on phone, email, browsing, of entire population",notclickbait
19 Truly Awkward Lube Confessions,clickbait
Can We Guess Your Personality Based On Your Froyo Order,clickbait
33 Weird Things You'll Find In Every British Person's Garage,clickbait
"In U.S., Steps Toward Industrial Policy in Autos",notclickbait
IMF head remains in New York prison; charged over alleged hotel sex attack,notclickbait
First Chinese tourists arrive in the UK,notclickbait
Euro 2008 Qualification: Finland defeats Kazakhstan 2-1 in Euro 2008 qualifier,notclickbait
"Laws allowing same sex marriage in Washington, D.C. go into effect",notclickbait
Phone hacking scandal prompts media review in Australia,notclickbait
Ukraine hurt by Russian gas deal,notclickbait
US TV host Conan O'Brien leads in late night ratings,notclickbait
18 Ways To Avoid The Holiday Blues This Year,clickbait
Oak Park and neighbors to study Les Golden's intergovernmental cooperation proposals,notclickbait
Missouri Edges Kansas With a Last-Second Shot,notclickbait
One dead after small plane crashes near Phoenix,notclickbait
16 Photos That Capture What It's Like Renting In Toronto,clickbait
We Know Your Zodiac Sign Based On Your Favorite Dog Breeds,clickbait
Silverjet ceases operations and enters administration,notclickbait
How Creepy Was Terrence Howard's Kiss At The Emmys,clickbait
22 Reasons Life Was Easier In 2005,clickbait
"Mia Farrow, Carole White testify in Charles Taylor's war crimes trial",notclickbait
"29 Of The Most Perfect Comebacks That Ever Happened On ""Friends""",clickbait
Boorishness Works for Berlusconi,notclickbait
Anonymous people reveal animal cruelty at Australian Inghams poultry producer factory using CCTV footage,notclickbait
Former First Lady of Taiwan Admits Laundering $2.2 Million,notclickbait
"Google doubles Gmail storage, adds text formatting",notclickbait
25 Things People With Thick Hair Can Simply Never Do,clickbait
Gwendoline Christie Showed Up To The Emmys Looking Like A Literal Goddess,clickbait
Can You Spell The Name Of This Welsh Village,clickbait
18 Headaches Everyone Who Works In An Office Knows,clickbait
Jenny Li and Thomas Dold win the 2008 Taipei 101 Run Up,notclickbait
Graner found guilty of mistreatment at Abu Ghraib,notclickbait
