headline,category
"It Took Us A Serious Minute To Figure Out Who The Famous Person On The Cover Of ""Elle"" Is",clickbait
Don't Try To Make Your Own Homemade Creme Eggs Because It's More Trouble Than It's Worth,clickbait
A Rescue Dog And Her Handler Who Worked At Ground Zero During 9/11 Were Honored With An Amazing Day,clickbait
Guinea to launch investigation into killing of protestors,notclickbait
Want To Call It Frisco? Ask The Hells Angels,clickbait
Here's How Orphan Black Fans Are Dealing With Tatiana Maslany's Emmy Loss,clickbait
"Microsoft Office dropped by Massachusetts, USA",notclickbait
"As Giants Break Camp, Coughlin Uses Lakers as Motivation",notclickbait
"One killed by suicide bomber in southern Russia, five wounded",notclickbait
Officials report 29 rebels killed in Yemen after clashes,notclickbait
Hualien warm-up of 2007 ING Taipei Marathon kicked off,notclickbait
This Is What Happens When You And Your Best Friend Have No Boundaries,clickbait
Is Your Force Awakened,clickbait
Teamsters site suggests Tigger pardoned,notclickbait
25 Reasons 2015 Was The Year Of The Geek,clickbait
Mongolia's ruling party wins elections as rioting subsides,notclickbait
Senior U.S. Diplomat Visits Myanmar,notclickbait
Which Non-Prince Disney Guy Is Your Soulmate,clickbait
Two people confirmed dead in Boston Marathon bombing,notclickbait
Orrin Hatch accidentally compares Iraq to Vietnam,notclickbait
Mobile ringtone tops the UK singles chart,notclickbait
Serbian firefighters shot at from Kosovo,notclickbait
Southern California hit by 5.1 earthquake,notclickbait
"Facebook down for ""upgrades""; multiple blogs suggest site was hacked",notclickbait
UK children's charities announce merger,notclickbait
Tennis: Andy Murray wins Montreal Masters 2009,notclickbait
Watch This Woman Surprise Her Girlfriend With The News She Will Be Her Kidney Donor,clickbait
"27 Funniest Moments From ""Whose Line Is It Anyway?""",clickbait
Robot Zoe detects life in Atacama Desert,notclickbait
16 Italian Landmarks That Are Actually Crap,clickbait
Australian rules football: Drouin through to 2010 Gippsland Football League Grand Final,notclickbait
New U.S. immigration bill proposes time-limit and employer scrutiny,notclickbait
Conrail Plan May Be Model for G.M.-Chrysler Crisis,notclickbait
Maoists in India Briefly Seize Passenger Train,notclickbait
U.S. Seeks to Reduce Ship Emissions in Coastal Areas,notclickbait
"Apple to give free cases, refunds to iPhone 4 owners",notclickbait
A.M.A. Opposes Government-Sponsored Health Plan,notclickbait
LeBron James Helps Cavaliers Complete Sweep of Hawks,notclickbait
7 Reasons Rey Is Definitely Luke Skywalker's Daughter,clickbait
Everyone's Favourite Childhood Anthem Just Got An Epic Makeover,clickbait
Coral Study in Mexico Suggests Rapid Sea Rise From Warming,notclickbait
"Bloggers cite rumors of US ""secret war"" with Iran and Syria",notclickbait
The 24 Funniest Tweets About Cats In 2015,clickbait
The Silence of Hybrids Causes Some Alarm,notclickbait
"Kristen Stewart Talks About Honesty, Privacy, And Her New Movie ""Equals""",clickbait
Former Astronaut Bolden to Be Interviewed for Top NASA Job,notclickbait
The Struggle Of Being Mixed Race,clickbait
Wikinews interviews author and filmmaker Peter John Ross,notclickbait
What Breakup Song Would Taylor Swift Write About You,clickbait
How To Turn Classic Thanksgiving Foods Into Boozy Cocktails,clickbait
OMG The Middle Finger Emoji Has Arrived And Here's How To Get It,clickbait
"Wikinews interviews Jon Greenspon, independent candidate for US President",notclickbait
30 people die in bombing in northwestern Pakistan,notclickbait
Scientists recreating the 1918 flu virus say 'it came from birds',notclickbait
17 Things Only '00s Disney Kids Will Remember,clickbait
Which X-Men Character Are You Based On Your Zodiac Sign,clickbait
How Do You Stay Fit In College,clickbait
New York Times reporter rescued in Afghanistan,notclickbait
"How Obsessed With ""Game Of Thrones"" Are You",clickbait
Can You Pass This Sunday School Test For Children,clickbait
Maoist guerrilla attacks kill at least 17 on first day of Indian elections,notclickbait
Adults Sit On Santa's Lap For The First Time,clickbait
United States bank receives death threats,notclickbait
31 Childhood Photos Of Amy Schumer That Are Just Too Damn Cute,clickbait
Leonardo DiCaprio's Face When Lady Gaga Walked By Him To Accept Her Award Is Everything,clickbait
Former US Vice President Dick Cheney: 'Barack Obama is a one-term President',notclickbait
17 Uncommon Survival Products That Will Actually Change Your Life,clickbait
"Bush speaks of goals for U.S. withdrawal from Iraq, decries calls for timetable",notclickbait
24 Spectacular One-Tier Wedding Cakes,clickbait
Wall Street Stumbles as the Day Nears an End,notclickbait
10 Places To Travel In 2016,clickbait
New York Assembly passes same-sex marriage bill,notclickbait
"Shut It All Down, This Is The Finest Moment In Human History",clickbait
"Let's Be Honest, GOP Candidate Lindsey Graham Has Dazzlingly Beautiful Eyes",clickbait
"With Selection of Nicks, Giants Move On From Burress",notclickbait
Guys Transform Into Pinups,clickbait
36 Crazy Gifts That Any Miyazaki Lover Will Go Nuts Over,clickbait
Can We Guess If You Are Team Peeta Or Team Gale Based On Your Zodiac Sign,clickbait
15 Rude Texts Your Tears Would Send You,clickbait
"Emo Kylo Ren Is Your New Favorite ""Star Wars"" Parody Account",clickbait
Football: Fulham FC sacks coach Chris Coleman,notclickbait
Solar powered plane completes first leg of transcontinental trip,notclickbait
"Italy Upsets Canada, 6-2, at World Baseball Classic",notclickbait
Avalanche in Canadian Rocky Mountains kills two,notclickbait
"21 Places Chandler Bing Might Be Instead Of Reuniting With The ""Friends"" Cast",clickbait
17 Times The Internet Perfectly Summed Up Being A Cancer,clickbait
Attorney General Challenges Anti-Bias Law in California,notclickbait
"How Brave Are You, Actually",clickbait
Barack Obama accepts US presidential nomination from the Democratic Party,notclickbait
16 Things Dermatologists Want You To Know About Your Skin,clickbait
Two killed as Islamic militants storm Philippine jail,notclickbait
Controversial Florida attorney Jack Thompson disbarred,notclickbait
"Do You Know If These Food ""Facts"" Are True Or False",clickbait
Forget the Cigarette Lighter Adapter. Now You Can Dock Your iPod in the Car Radio.,notclickbait
Two dead after building collapse in Kenya,notclickbait
U.N. Leads Evacuation From Sri Lanka,notclickbait
"This Is What The Cast Of ""Made In Chelsea"" Would Look Like As Dogs",clickbait
15 Surprising Actors Who Unknowingly Sparked My Sexual Awakening,clickbait
NASA: Hopes raised for shuttle flights to resume soon,notclickbait
Can You Pass This Texas Food Test,clickbait
8 Signs You Were Raised In The South,clickbait
Can You Name These Adorable Instagram-Famous Pets,clickbait
Controversy after leak of preliminary report into Spanair disaster,notclickbait
FBI says Jennifer Hudson's nephew found dead,notclickbait
Ex-Soldier Gets Life Sentence for Iraq Murders,notclickbait
25 Times Blue Ivy Had Her Shit Together Better Than You,clickbait
Markets dragged down by credit crisis,notclickbait
10 Books That Will Get You In The Mood On Valentine's Day,clickbait
Duke Tops Texas to Advance to Round of 16,notclickbait
Drake Shared A Sweet Instagram Post Thanking Rihanna For His Only No. 1 Songs,clickbait
"How Well Do You Remember Season 1 Of ""Friends""",clickbait
"20,000 Californian state workers may lose their jobs",notclickbait
18 Pugs Who Forgot Very Important Things,clickbait
North Korea Said to Detain U.S. Reporters,notclickbait
"How Well Do You Remember The ""Filthy Animal"" Scene From ""Home Alone""",clickbait
British charities form fund recovery group,notclickbait
Arrest made in Newark Airport security breach,notclickbait
"If You're Excited For The New ""Star Wars"" Movie You Have To See This Art",clickbait
"Michael B. Jordan Got Laid The Fuck Out While Filming ""Creed""",clickbait
19 People Who Contoured Better Than You In 2015,clickbait
John Stamos Blessed The World With A Photo Of His Bare Ass For Paper Magazine,clickbait
What's The Best Haunted House You've Ever Been To In The U.S,clickbait
Are You More Matt Damon Or Ben Affleck,clickbait
Extreme Phone Pinching Is Possibly The Most Nerve-Racking Internet Craze Yet,clickbait
Watch These Grown-Ups Freak Out Over Virtual Puppies,clickbait
This Is The Worst Version Of Your Favourite Mariah Carey Song,clickbait
Long Line at the N.B.A. Complaint Desk,notclickbait
This Is What My Mother's Eating Disorder Has Taught Me,clickbait
Believers Play The Ouija Board,clickbait
Al-Qaeda says another bin Laden tape to be released,notclickbait
Which Iconic Celebrity GIF Are You Based On Your Biggest 2015 Achievement,clickbait
Fake impotence drugs linked to low blood sugar outbreak,notclickbait
Former NBA ref surrenders to charges he bet on games he officiated,notclickbait
Peer-to-peer file-sharing user numbers still growing,notclickbait
17 Dads Who Are Dad AF,clickbait
Volvo Ocean Race Comes to a Close,notclickbait
16 Words That Mean Something Completely Different At Target,clickbait
Rio de Janeiro to host 2016 Olympics,notclickbait
35 Foods That Pretty Much Sum Up Your Childhood,clickbait
How Well Can You Really Match Colors,clickbait
Football Vs. Wife: Which Do You Know Better,clickbait
"Phoebe From ""Friends"" Is Literally The Fucking Worst",clickbait
Bomb Kills 7 Afghan Civilians at U.S. Base,notclickbait
"How ""The Martian"" Went From A Best-Selling Novel To A Blockbuster Film",clickbait
Deposed Mauritanian president Sidi Ould Cheikh Abdallahi is released,notclickbait
Do You Actually Remember These Disney Channel Show Theme Songs,clickbait
17 Textbooks That Forgot How To Be Textbooks,clickbait
Broadband users kicked off service for constant questioning,notclickbait
Request Timeout,clickbait
CW Adds Shows to Text About,notclickbait
Lupita Nyong'o Had The Perfect Response To Lack Of Racial Diversity At The Oscars,clickbait
Confessions To The One That Got Away,clickbait
Ellen DeGeneres As A Member Of One Direction Is Too Perfect,clickbait
"Its Population Falling, Russia Beckons Its Children Home",notclickbait
India may rise as regional power,notclickbait
15 Instrumental Covers Of Pop Songs That Are Better Than The Original,clickbait
Last-Second Shot Sends Villanova Past Pitt and Into Final Four,notclickbait
Virginians melee at used Apple iBook sale,notclickbait
Somalia food hijackers make new demands,notclickbait
15 Hits From 1996 That'll Make You Feel Old AF,clickbait
Philippines prepares for new typhoon,notclickbait
Ousted Honduran president says crisis deal has failed,notclickbait
Are Your Hook Up Habits Like Everyone Else's,clickbait
18 Celebrity Snapchat Accounts That'll Change Your Snap Life,clickbait
Social Media Vs. Real Life,clickbait
"Let's See How Well You Remember The First Episode Of ""Misfits""",clickbait
At least 85 dead in shooting at Norwegian youth camp,notclickbait
Which Netflix Original Series Should You Star In,clickbait
Pediatrician in Molesting Case Agrees to Stop Practicing Medicine,notclickbait
Can You Match The Song To The All Time Low Album,clickbait
"These Pictures From The ""Fuller House"" Set Will Make You Extremely Nostalgic",clickbait
South Africa defeats Australia in second cricket test,notclickbait
Pakistani Prime Minister agrees to put all state executions on hold,notclickbait
Meet The 4-Year-Old Twins Who Are Taking The Modeling World By Storm,clickbait
Germany's July unemployment rate falls slightly,notclickbait
Awesome Irn-Bru Cocktails,clickbait
The Wait Is Over: You Can Now Put Your Penis In A Mouth-Vagina-Anus Robot,clickbait
New Zealand dollar hits new high versus the United States dollar,notclickbait
22 Faces That Perfectly Capture The Struggle Of Trying To Act Sober,clickbait
This Phone Accessory Will Make Your Photos Look Sick As Hell,clickbait
Which Taylor Swift Tattoo Should You Get,clickbait
Indian Army celebrates Victory Day on 35th Anniversary of Bangladeshi Liberation,notclickbait
LaShawn Merritt and Sanya Richards Cruise to U.S. Titles in 400 meters,notclickbait
Jackie Chan Strikes a Chinese Nerve,notclickbait
Toyota quits Formula One,notclickbait
BT's Lalani smashes through the £1m salary barrier,notclickbait
"Is This Celeb Danish, Norwegian, Or Swedish",clickbait
Men Have Learned How To Braid Their Hair And They're Not Looking Back,clickbait
11 Ridiculous Selfie Confessions,clickbait
Google now worth over $80 billion,notclickbait
Romanian investor kidnapped in the Democratic Republic of the Congo is safe,notclickbait
Can You Get A Perfect Score On This California Quiz,clickbait
20 Cereal Recipes to Stress-Eat Between New Episodes of Serial,clickbait
BBC drops programmes as third of staff join strike,notclickbait
"Would You Receive The Final Rose From ""Bachelor"" Ben Higgins",clickbait
Reminder That Jennifer Lopez Is Not A Real Human,clickbait
"Should RealNetworks, an Internet Pioneer, Switch Gears?",notclickbait
Angolan police arrest two after attack on Togo football team,notclickbait
15 Holiday Cocktails That Are Basically Dessert,clickbait
Viacom Profit Falls 69% as Revenue Remains Flat,notclickbait
23 Tweets That Prove You Should Never Cross Cara Delevingne,clickbait
UN official: 90 Rwandan rebels killed in DRC by army troops,notclickbait
"We Know Your ""Harry Potter"" Trick-Or-Treating Partner Based On Your Birth Month",clickbait
Australian States to launch high court battle against IR reforms,notclickbait
22 Home Decor Pieces That Will Make You Wish You Were Dead,clickbait
Kendall Jenner And Gigi Hadid Transformed This Homeless Kid Into A Hot Model,clickbait
9 Facebook Events You'd Actually Want To Attend,clickbait
Nuclear leaks after Japan quake are worse than first reported,notclickbait
"Arturo Gatti, Former Boxing Champion, Found Dead in Hotel Room",notclickbait
Mark Fidrych Remembered for Remarkable Season and Endearing Antics,notclickbait
"22 Hilarious Pictures Only ""The Walking Dead"" Fans Will Understand",clickbait
Are You Really A Mermaid,clickbait
New York Doctors Race to Abide by In-Office Surgery Law,notclickbait
"If Ryan Reynolds Could Give You Advice, What Would You Ask Him",clickbait
Indians Are Protesting Child Marriage With The Hashtag #StrengthToSayNo,clickbait
24 Tweets That Will Make Every Nurse Laugh Out Loud,clickbait
Former Texas nurse charged with murder for allegedly injecting bleach into patients,notclickbait
Israel undergoes major emergency drill,notclickbait
Monica Seles Among 4 Inducted Into Hall of Fame,notclickbait
"18 Confessions That Prove You're Not Alone In Your ""The Bachelor"" Obsession",clickbait
Building in Barcelona damaged by explosion,notclickbait
16 Times Tumblr Made You Think Too Hard,clickbait
Joran van der Sloot charged with murder of Peruvian woman,notclickbait
Welsh soap opera Pobol y Cwm celebrates 35 years on air,notclickbait
Find Your Next Great Book With The BuzzFeed Books Newsletter,clickbait
Denver Broncos player Kenny McKinley found dead aged 23,notclickbait
"UN: Ethiopian GDP grew only 1.7% in 2009, may not reach anti-poverty goals",notclickbait
24 Hilariously True Tweets For Retail Workers About The Plastic Bag Charge,clickbait
21 Last-Minute Gifts That Are Actually Thoughtful,clickbait
The Drake Relays: a Big-Time Meet in a Small-Town Atmosphere,notclickbait
15 Struggles Everyone Who Has A Celebrity Crush Knows To Be True,clickbait
"Steve Kubby, co-author of California Proposition 215, grows dangerously ill in US custody",notclickbait
What Are Some Misconceptions About OCD,clickbait
We Surprised Our Coworkers With BB-8 And Here's What Happened,clickbait
What Does Your Taste In Dessert Say About You,clickbait
This Guy Invented Extra Long Selfie Arms And It's The Weirdest Thing Ever,clickbait
Can You Guess Why This Winchester Brother Is Crying,clickbait
We Know How Addicted You Are To Social Media Based On One Question,clickbait
Philippines welcomes world's 7 billionth baby,notclickbait
Thai court strips ex-Prime Minister of $1.4 billion,notclickbait
Greece wildfires force thousands to evacuate,notclickbait
Controversial cancer test gains support,notclickbait
28 Bros Who Absolutely Crushed 2015,clickbait
15 Times Chris Traeger Inspired You To Be Your Best Self,clickbait
Milk Scandal in China Yields Cash for Parents,notclickbait
Creationist sentiments affect Imax business strategy,notclickbait
China's economy surpasses Japan's in second quarter,notclickbait
These Mini Cheesecakes Will Make You So Content With Life,clickbait
National Guard mobilized in Kentucky ice storm aftermath,notclickbait
"Defending World Skating Title, Germans Take Pairs Lead",notclickbait
New Zealand's South Island and southern North Island struck by storms,notclickbait
28 Picture Tweets Guaranteed To Make Absolutely Everyone Laugh,clickbait
"All The ""Star Wars"" Fan Art You Didn't Know You Needed",clickbait
Lewis Hamilton wins 2008 Monaco Grand Prix,notclickbait
Can We Guess Your Personality Based On Your Resting Bitchface,clickbait
Stolen Utahraptor recovered in Australian Capital Territory,notclickbait
Basketball: Lakers score 102 to defeat the Celtics in Game 1 of the 2010 NBA Finals,notclickbait
Cricket: Scotland v Pakistan abandoned due to rain,notclickbait
This Oreo Popcorn Is The Movie Snack You Need Right Now,clickbait
Google Maps incorporates satellite images,notclickbait
Everything You Need To Know About Empress Of,clickbait
Tell Us About A Time You Really Fucked Up,clickbait
"Despite Odds, Cities Race to Bet on Biotech",notclickbait
Davie Shipyard sale cleared by Québec court,notclickbait
"PSA: Beware The ""Star Wars"" Hype",clickbait
"24 Times The ""How To Get Away With Murder"" Cast Gave Us Serious Squad Goals",clickbait
Iraqi Lawmaker Is Charged With Masterminding an Attack on Parliament,notclickbait
Santas Guess Bizarre Candy Cane Flavors,clickbait
Here's Where You Should Be Shopping If You Love Victoria's Secret,clickbait
"Male Mice Sing to Woo, but the Females Answer Just a First Call",notclickbait
Connecticut Serial Killer Competent- Waives Further Appeals,notclickbait
Here's Proof That Brining Your Turkey Is Stupid And Wrong,clickbait
Police evict Vestas protesters,notclickbait
54 Lady Gaga Lyrics For When You Need A Fire Instagram Caption,clickbait
"In Bleak Afghan Outpost, Troops Slog On",notclickbait
Clashes in France after anti-condom speech by Pope,notclickbait
17 Times The Internet Nailed What It's Like To Be A Pisces,clickbait
Fourteen dead in two attacks in Somalia,notclickbait
"Obama's first State of the Union speech focuses on economy, jobs",notclickbait
19 Times Canadians Were Condescending To Americans About Winter,clickbait
Coosh Headphones Are Meant to Stay Put,notclickbait
Afghanistan general Stanley McChrystal cleared of wrongdoing,notclickbait
27 Times BBC News Failed So Hard It Just Failed,clickbait
"38 Questions From ""Friday Night Lights"" We Still Need An Answer To",clickbait
8 Ways To Style Your Hair For The Gym That Are Actually Awesome,clickbait
Natalie Portman Looks Exactly Like Jackie Kennedy In Her New Biopic,clickbait
Here Are 18 Romantic AF Movies & Shows To Stream On Valentine's Day,clickbait
Wikimedia Commons celebrates first anniversary,notclickbait
Industry Ignored Its Scientists on Climate,notclickbait
Couples Find Out If Their Stories Of How They Met Add Up,clickbait
Bus explosion in Pakistan kills at least 40,notclickbait
Adult Survivors Of Child Sexual Abuse Are Speaking Up In This New Video Series,clickbait
Second Claim of Paternity for President of Paraguay,notclickbait
Court legalizes same-sex marriage in New Brunswick,notclickbait
Which Kardashian/Jenner Should Be Your BFF,clickbait
I Won The Battle Against Button-Down Shirt Gapping For Under 15 Dollars,clickbait
U.S. Helps Palestinians Build Force for Security,notclickbait
"Here's What The ""Mona Lisa"" Looks Like With Celebrities' Brows",clickbait
Epiphanny Prince Scores 24 Points as Rutgers Tops West Virginia,notclickbait
Yankees Hire Top Real Estate Brokerage to Market Its Premium Tickets,notclickbait
28 Profoundly Beautiful Quotes About Life And Death,clickbait
North Korea prepared for 'sacred' nuclear war with South,notclickbait
Argentine President harshly criticizes US border fence,notclickbait
Iraqi provincial elections relatively peaceful,notclickbait
42 Very Urgent Questions I Have For Cats,clickbait
Which Zodiac Sign Do You Think Fits You Best,clickbait
English Premier League: Week 33 round-up,notclickbait
17 Times Titus Andromedon Lived Life To The Absolute Fullest,clickbait
Everything You Need To Know About Floating Iceberg Hot Chocolate,clickbait
Zidane apologises for headbutt,notclickbait
Champions League Final May Settle Ronaldo-Messi Debate,notclickbait
"Everyone's Freaking Out Over The Season Premiere Of ""Arrow""",clickbait
9 Women In Movies Who Somehow Brought In All The Money This Year,clickbait
"21 Reasons ""It's A Wonderful Life"" Is The Best Christmas Movie Of All Time",clickbait
Bomb explosions kill several people in central Baghdad,notclickbait
8 Things To Help You Talk To Your Family About Your Eating Disorder,clickbait
Diane Keaton Running To Get Froyo Is Diane Keaton Living Her Best Life,clickbait
"Parker and Duncan Play Well, but Spurs Are Pushed to Brink",notclickbait
South Ossetia says it will join North Ossetia-Alania as a federal subject of Russia,notclickbait
"41,000 Indians Have Petitioned The Censor Board For More Gender-Sensitive Ratings",clickbait
"15 Times ""She's The Man"" Accurately Portrayed High School Life",clickbait
18 Snapchats That Hit Too Close To Home,clickbait
"Henry Cavill Is So Hot, He Can Make You Think Turtlenecks Are Attractive",clickbait
When Your Friend Is A Coffee Snob,clickbait
"Hospitals declare ""code red"" in Wellington, New Zealand",notclickbait
Listen To Women Talk Honestly About Loving Their Bodies,clickbait
Seven Canadians killed by Israeli air strike,notclickbait
Can You Predict The Winners Of The 2016 Golden Globe Awards,clickbait
Verizon Wireless VoIP Device Cuts the Landline,notclickbait
Which Pop Anthem Matches Your Birth Month,clickbait
"Which Taylor Swift ""1989 World Tour"" Guest Are You Based One Question",clickbait
Automakers Seek $14 Billion More in Aid,notclickbait
Miss California USA Will Keep Her Title,notclickbait
"For Tiger Woods, Timing Is Everything",notclickbait
Many G.M. Plants Will Take the Summer Off,notclickbait
Pope Benedict XVI visit to the United States begins,notclickbait
Justin Bieber Just Broke A Record Set By The Beatles,clickbait
26 Breathtaking U.S. Sights You Need To See Before You Die,clickbait
"2015 You're Great And I'ma Let You Finish, But 2006 Had The Best Music Of All Time",clickbait
Experts raise serious questions over safety of U.S. oil industry and warn another spill may be 'unavoidable',notclickbait
People Keep Making Huge Facebook Chats With People With The Same Name,clickbait
Greece's Orthodox Church leader Christodoulos dies at age 69,notclickbait
Kung Fu star Carradine found dead in Bangkok hotel,notclickbait
"F1: Massa wins 2008 Brazilian Grand Prix, Hamilton wins championship",notclickbait
Eleven die in truck-van crash in Kentucky,notclickbait
Can You Identify Which Disney Channel Movie Each Celebrity Was In,clickbait
Shelling in Somalia's capital kills twenty,notclickbait
"UK television presenter sacked after ""golliwog"" comment",notclickbait
Warner Brothers Plans to Cut 800 Jobs,notclickbait
23 Gifts That Will Make All Makeup Lovers Swoon,clickbait
20 Badass Tattoos Inspired By Health And Wellness,clickbait
What's The Strangest Way You've Lost A Tooth,clickbait
British student falls to his death from 10th floor window,notclickbait
15 Delectable Overnight Oats That Are Totally Worth Getting Out Of Bed For,clickbait
Which Famous Movie Sidekick Are You Based On Your Zodiac,clickbait
West Virginia Governor Is Urged to Add Financing for Mental Health Care,notclickbait
"The One Person You Probably Never Noticed In Britney Spears' ""Piece Of Me"" Music Video",clickbait
Australia commits more troops to Afghanistan,notclickbait
Cypriot court begins Greek air disaster trial,notclickbait
What It's Like To Write The Most Hyped Book Of The Year,clickbait
What's The Best Halloween Costume Your Kid Has Ever Worn,clickbait
UK retailers MFI and Woolworths collapse,notclickbait
"Which ""How To Get Away With Murder"" Character Should Be Your Partner In Crime",clickbait
ABC to Merge 2 TV Units to Streamline and Cut Costs,notclickbait
"N.C.A.A. Drought Over, Syracuse Moves to Second Round",notclickbait
I Had My Hair And Makeup Done Like Kim Kardashian For A Week And Here's What Happened,clickbait
Ted Kennedy diagnosed with brain tumor,notclickbait
"Which ""Harry Potter"" Villain Are You Based On Your Zodiac",clickbait
Dolphin dies during performance at theme park,notclickbait
Gay Men Asked Straight Men What They've Always Wanted To Know,clickbait
Convicted murderer Leonard Peltier again denied parole,notclickbait
UN emphasizes importance of women's health in Africa,notclickbait
Canadian Conservatives vow to defend Arctic sovereignty,notclickbait
Do You Have The Best Photo Of A Kid Freaking Out With Santa,clickbait
Holy Shit This Guy Looks Exactly Like A Young Leonardo DiCaprio,clickbait
Democrat staffers obtained Maryland lt. governor's credit report illegally,notclickbait
13 Things You Should Never Say To A Latina When Dating,clickbait
Politicians call for NY Sen. Monserrate to resign after assault conviction,notclickbait
Up to 31 reported dead as Libyan government troops attack Misrata,notclickbait
Tell Us Your Stories About Sexism In College,clickbait
Can We Guess What You Look Like From These 10 Questions,clickbait
Documents show U.S. knew of Guatemalan human rights abuses,notclickbait
Nobel Peace Prize awarded to Kenyan environmental activist,notclickbait
Orlando Ousts Defending Champions,notclickbait
19 Brutally Honest Confessions From A Tesco Worker,clickbait
