headline,category
There's A Weird Geographical Quirk About Sweden's Match Against Denmark This Week,clickbait
Adele Is Currently Experiencing What She Put All Of Us Through For The Last Four Years,clickbait
"In Minnesota, a Battle Without End for a Senate Seat",notclickbait
Queen RiRi Might Be Dating Travis Scott,clickbait
"Spend $10,600 on the Yankees, or on College or  a Car?",notclickbait
"Here's Why ""Paw Patrol"" Is A Terrible Kids' Show",clickbait
"Which Song From ""Steven Universe"" Are You",clickbait
More Business Travelers Putting Away the Suitcase,notclickbait
Spanish newspaper co-founder Carlos Mendo dies aged 77,notclickbait
NASCAR: Edwards wins 2010 Kobalt Tools 500,notclickbait
U.S. Senate defeats bill banning gay marriage,notclickbait
The New Wonder Woman Movie Officially Looks Amazing,clickbait
Near-Complete Fossil Offers Insight on Early Fish,notclickbait
Oestgaard Buaas Retains U.S. Slopestyle Title,notclickbait
Canada's Dollaramas Are Raising Their $1 Prices And It's Bullsh*t,clickbait
38 Genius Ways To Save Money On Travel In 2016,clickbait
"The Goddam Internet Did It Again With This Lip-Dub Of Olivia From ""The Bachelor""",clickbait
"Eritrea plans to vaccinate 500,000 children",notclickbait
2007 FIFA U17 World Cup: Germany eliminates Americans; sets up England quarter final,notclickbait
Professor Accused of Pocketing NASA Money,notclickbait
American war deserter given stay of deportation in Canada,notclickbait
Bank of America to Receive Additional $20 Billion,notclickbait
11 Things You've Definitely Googled Before,clickbait
A Whiff of Controversy and South African Wines,notclickbait
11 Types Of Student Everyone Meets At University,clickbait
An Eight-Months Pregnant Bridesmaid Went Into Labor The Morning Of Her Friend's Wedding,clickbait
"After a Pause, Wall Street Pay Bounces Back",notclickbait
Which Fantastic Magical Beast Are You Based On Your Zodiac Sign,clickbait
Boeing 767 cargo plane seriously damaged by fire at San Francisco,notclickbait
"How Well Do You Remember ""30 Rock""",clickbait
Two new cases of West Nile Virus reported in Indiana,notclickbait
16 Photos That Prove Just How Hardcore Curling Is,clickbait
21 Signs That Prove Booksellers Are The Absolute Best,clickbait
Australian and New Zealander freemasons arrested for sorcery in Fiji,notclickbait
We Tried Stand-Up Comedy For The First Time And It Was Just Awful,clickbait
7 Bizarre Facts You Didn't Know About This Week In History,clickbait
Dead body left in UK hospital alongside living patients for seven hours,notclickbait
Somali opposition group al-Shabaab to block WFP food aid,notclickbait
BHP Closing Nickel Mine as Commodity Prices Fall,notclickbait
Panic! At The Disco's New Music Video Is The Creepiest Thing You'll See All Week,clickbait
14 Songs From The Early 2000s That Are Now Modern Day Christmas Classics,clickbait
Here's Justin Trudeau Walking The Wrong Way Up An Escalator For All Eternity,clickbait
17 Things People Who Don't Need Glasses Will Never Understand,clickbait
Tight Mortgage Rules Exclude Even Good Risks,notclickbait
Mob kills 'witches' in Kenya,notclickbait
Wikileaks.org restored as injunction is lifted,notclickbait
24 Times Ruby Rose And Phoebe Dahl Defined Relationship Goals In 2015,clickbait
Surf's up in Chile; championship competition in Pichilemu,notclickbait
Scholarships awarded to isolated pacific islanders in Micronesia,notclickbait
Watch 80 Years Of Halloween Costumes In Under Three Minutes,clickbait
This Video Is For Every Girl Who Can't Do Makeup,clickbait
21 Words That Meant Something Completely Different In 2006,clickbait
Can This Little Gadget Help Your Posture,clickbait
"Norway Wins, While Russia Calls the Tune",notclickbait
"Urging Freedoms, Obama Chides Zimbabwe Leader",notclickbait
"Adam Woodyatt Is Upset A #HowsAdam Moment Didn't Happen During The ""Corrie"" Live Episode",clickbait
Can You Guess Which Celeb Made This Art,clickbait
"26 Jokes Guaranteed To Make ""Star Wars"" Fans Laugh Every Time",clickbait
Banks Foreclose on Builders With Perfect Records,notclickbait
Republican Throwbacks Taking Aim at Court Pick,notclickbait
17 Things All Girls With Too Much Hair Will Understand,clickbait
U.S. Diplomat Makes a Trip to Myanmar,notclickbait
Bush nominates Alito to U.S. Supreme Court,notclickbait
NASA's Phoenix spacecraft lands safely on Mars,notclickbait
An Inexpensive Digital Edge on the Golf Course,notclickbait
23 Weird As Hell U.S. Laws You Won't Believe Are Real,clickbait
Would You Time Travel To The Past Or Future,clickbait
Are You More Ja Rule And Ashanti Or Ja Rule And J.Lo,clickbait
Russian passenger airliner makes safe landing in Moscow after concerns of gear damage,notclickbait
Taiwan's cabinet resigns,notclickbait
Sri Lankan Troops Breach Rebel Haven,notclickbait
Here's What Meg Cabot Learned About Situational Depression,clickbait
"If You Were Stranded On Mars, Which Vegetable Would You Eat",clickbait
Tens of thousands protest in London before Copenhagen climate change summit,notclickbait
"Boat in DR Congo capsizes, 80 feared dead",notclickbait
Headless man found near suburban Chicago school,notclickbait
Watch People Struggle Trying To Guess Urban Dictionary Terms,clickbait
"Scotland Yard says suicide bomb blast killed Bhutto, not bullet",notclickbait
International experts probe deadly Ebola Reston virus outbreak in Philippine pigs,notclickbait
17 Desserts Guaranteed To Turn You Into A Chocoholic,clickbait
We Know Your Favorite Dog Breed Based On Your Favorite Snack,clickbait
"These 24 Moments From ""Pride & Prejudice"" Will Make Your Heart Melt",clickbait
Tyra Banks Announced The Birth Of Her First Child In The Most Adorable Way,clickbait
Air France jet with 228 on board goes missing,notclickbait
"Marnie Piper Is Returning To The Town From ""Halloweentown""",clickbait
"In Minnesota, Another Bid for a Recount",notclickbait
"Murdoch empire in crisis after newspaper closes: BSkyB bid halted, former editor arrested, anger at chief executive",notclickbait
This Color Test Will Determine Your Guilty Pleasure,clickbait
"27 Funny, Bizarre, And Ingenious Excuses People Have Used To Skip School",clickbait
Former Chilean President Pinochet suffers heart attack,notclickbait
"In Debate on Spending, a Detour for Politics",notclickbait
"One Direction's New Music Video For ""Perfect"" Is Actually Perfection",clickbait
Trustee May Take Helm of Union Local in Dispute,notclickbait
17 Moments That Are Too Real For Anybody Who's Not Totally Out Of The Closet,clickbait
South African Prosecutors May Drop Fraud Charges Against A.N.C. Leader Jacob Zuma,notclickbait
Students Have A Legal Right To Safe Spaces,clickbait
"17 Tweets About ""The Force Awakens"" That Will Make You Laugh Your Ass Off",clickbait
Dulko Sends Sharapova to Another Early Exit,notclickbait
Salma Hayek Had To Go To The ER In An Embarrassing T-Shirt,clickbait
Meet One Of The Filthiest Female Characters You'll See Onscreen This Year,clickbait
"PSA: There's A Chrome Extension That Blocks ""Star Wars"" Spoilers",clickbait
"Wikinews interviews Brian Moore, Socialist Party USA presidential candidate",notclickbait
Profit Dropped 14% in Quarter for Staples,notclickbait
These Pit Bull Brothers Are The Cutest Thing You'll See All Day,clickbait
We Know Your Zodiac Sign Based On The Things You Like,clickbait
24 Of The Most Motivational Celebrity Tweets Of All Time,clickbait
Prisons in New Zealand to introduce mobile phone jamming technology,notclickbait
Scottish Court Hears Appeal in 1988 Blast on Jetliner,notclickbait
Israeli PM Ariel Sharon briefly opens eyes,notclickbait
Uniting Church at Auburn destroyed by fire,notclickbait
"Tropical Storm Adrian forms in Eastern Pacific, threatens Central America",notclickbait
"In Battle to Land Embattled Governor, Messages Show Extra-Sharp Media Elbows",notclickbait
"27 Times Tiffany From ""Daria"" Was Iconic AF",clickbait
Lebanon car bombings kill dozens outside mosques,notclickbait
Employment Contracts Are Now Viewed as Rewritable,notclickbait
How Much Of A Grammar Perfectionist Are You,clickbait
VW and Porsche Merger Is Back on Track,notclickbait
13 Things To Do For Your Friend With Post-Natal Depression,clickbait
16 Teens Who Are Going To Rule The World In 2016,clickbait
Five beheaded during violent prison riot in Brazil,notclickbait
Felipe Massa wins 2008 Turkish Grand Prix,notclickbait
How Many Of These Books By YouTube Stars Have You Read,clickbait
"Very Lonely Luke Is The Latest Hilarious ""Star Wars"" Parody Twitter Account",clickbait
19 Things Anyone Who's Best Friends With Their Mum As An Adult Will Understand,clickbait
UK Parliamentary Commissioner for Standards to investigate Nadine Dorries reality TV appearance,notclickbait
33 Love Songs From The Early '00s You'll Never Forget,clickbait
31 Tweets About Fast Food That Will Actually Make You Laugh,clickbait
"Poll: Arabs discouraged by US policies, back nuclear-armed Iran",notclickbait
"The Rise, Fall, And Improbable Comeback Of Morris Brown College",clickbait
Is 2016 The Year You Stop Being Single,clickbait
Ignored warnings 'worsened' situation in Myanmar,notclickbait
This New Movie May Be The Best Use Of 3D Ever,clickbait
There Are So Many More Penis Emojis Now,clickbait
How Well Do You See Color,clickbait
Broadcaster Paul Harvey dies at age 90,notclickbait
Instagram Star Reveals The Truth Behind Her Photos,clickbait
Guatemalan president and first lady granted divorce,notclickbait
21 Cosy AF Bedroom Goals,clickbait
Live 8 concert plans announced,notclickbait
Many US TV stations preparing to make digital switch despite new legislation,notclickbait
First casualty of French riots reported,notclickbait
Oil prices fall as reserves are released,notclickbait
25 Feminist Songs That Always Make You Feel Like A Boss,clickbait
These High School Students Just Shut It Down With This Epic Lip Dub Video,clickbait
Elections held in Bulgaria,notclickbait
Alassane Ouattara 'wins' Ivory Coast presidential election,notclickbait
Canada Drops W.T.O. Complaint Against Europe,notclickbait
2-year-old dies in car in 100ºF heat with windows rolled up,notclickbait
The 12 Days Of Khaled,clickbait
Gannett Reports a 60% Fall in  Quarterly Profit,notclickbait
"Scuderi, an Unlikely Savior, Emerges for the Penguins",notclickbait
Police social media frenzy threatens to prejudice alleged child killer trial,notclickbait
What Kind Of Pop-Tart Matches Your Personality,clickbait
Amy Schumer's Press Room Interview After She Won Her Emmy Is Iconic,clickbait
16 Truths For People Who Get Major Anxiety When Texting,clickbait
Gerrans Wins 14th Stage of Giro on Uphill Stamina,notclickbait
Bush nominates John G. Roberts for U.S. Supreme Court,notclickbait
"The Economy Is Bad, but 1982 Was Worse",notclickbait
Which Of Justin Bieber's Hairstyles Are You,clickbait
"The ""I Think I Hear Your Girlfriend Calling You"" Puzzle",clickbait
How To Say No,clickbait
Somali Group Said to Hold 2 Frenchmen,notclickbait
NBC Still Waiting for a Hit From Its Hit Maker,notclickbait
Barclays Says It Will Not Seek Bailout,notclickbait
"22 Reasons Fans Are Obsessed With ""The Walking Dead""",clickbait
Obama Pledges Attention to Flooding,notclickbait
Would You Be A Better Date Than My New Man,clickbait
"19 Life Lessons From ""500 Days Of Summer""",clickbait
I.B.M. Affirms Earnings Goal Despite Sales Slide,notclickbait
European airline Ryanair fined over ash-triggered flight cancellations,notclickbait
France beat Ireland in RBS Six Nations,notclickbait
17 Cats Really Loving The Cat Nip,clickbait
The Hardest NHL Logo Quiz You'll Ever Take,clickbait
What Type Of Thanksgiving Turkey Should You Make,clickbait
Republican Congressman Ron Paul endorses Constitution Party nominee Chuck Baldwin for President of the United States,notclickbait
This Duo Is Travelling Across India For A Year To Highlight The Issues Nobody's Talking About,clickbait
What Your Crush Says VS What You Think,clickbait
The Mona Lisa Just Turned Down Cara Delevingne For A Date,clickbait
Taliban Truce Seems in Flux in Pakistan,notclickbait
Here's How To Get A Haircut You Actually Like,clickbait
Bomb destroys Spanish police barracks and kills policeman in Basque Country,notclickbait
UK House of Commons' Speaker resigns,notclickbait
Study estimates first human HIV infection 100 years ago,notclickbait
A Shortcut To Hogwarts Has Been Spotted In Montreal,clickbait
What's The Biggest Misconception About Being A Military Spouse,clickbait
Obama Telephones Afghan President,notclickbait
35 Things That Will Hit You Right In The Childhood,clickbait
Ingredient Costs Push Profit Lower at General Mills,notclickbait
Who Said It: Chandler Bing Or Liz Lemon,clickbait
Landon Donovan the Striker Is Also a Lightning Rod,notclickbait
Reese Witherspoon Just Called Out Hollywood Ageism And Sexism And It Was Beautiful,clickbait
29 Pictures That Will Finally Give You Some Goddamn Satisfaction,clickbait
Kyrgyzstan votes on referendum for new constitution,notclickbait
11 Quotes From Harry Potter To Help You Cope With Loss,clickbait
U.S. Issues Scathing Report on Immigrant Who Died in Detention,notclickbait
Why You Should Be Proud To Be A Slytherin,clickbait
Miles Franklin Literary Award nominates only women for potential winners,notclickbait
What's Your Favorite Book With A Great LGBT Lead Character,clickbait
"At Paris Air Show, Little Flash and Lots of Introspection",notclickbait
Brazilian soccer player's mother freed by kidnappers,notclickbait
You Can Personalize Your Own Adult Coloring Book With Your Name On It,clickbait
Feist leads 2008 Juno Award winners,notclickbait
"Which ""Friday Night Lights"" Quarterback Is Your Soulmate",clickbait
Can You Find All 23 Chameleons Hiding In This Forest,clickbait
Glastonbury headliners announced,notclickbait
Which Famous Teenager Are You,clickbait
Canada pursues new nuclear research reactor to produce medical isotopes,notclickbait
13 Meet-Cute Stories That Actually Happened In Real Life,clickbait
Football: Kežman goes to Madrid,notclickbait
People Met Pet Rats For The First Time And Lost Their Damn Minds,clickbait
Controversial Boxer Tyson Fury Stripped Of Heavyweight Title Just Two Weeks After Winning It,clickbait
"Planets Jupiter, Mercury and Mars line up, visible to naked eye",notclickbait
Are You More Donald Trump Or Donald Duck,clickbait
"Two killed, two seriously injured after boulder collapses onto house in Stein an der Traun, Germany",notclickbait
27 Tweets About Starbucks That'll Actually Make You Laugh,clickbait
"Which ""AHS"" Character Are You Based On Your Choice Of Cake",clickbait
16 Jackie Chan Stunts That Perfectly Capture Your Twenties,clickbait
Tropical Storm Ignacio forms over the Pacific,notclickbait
Supreme Is Tight But Maybe Not These Hoodies With Hentai On Them,clickbait
This Veterinarian Ate With A Neglected Dog In A Cage To Make Her Feel Comfortable,clickbait
Ferry collision on the river Mersey,notclickbait
17 Mindblowing Ways To Eat Bagels,clickbait
An Open Letter To Anyone Who's Ever Tweeted Anything Mean About The Rock,clickbait
Kylie Jenner And Jenna Marbles Read Mean Tweets About Their Dogs And It Was Hilariously Mean,clickbait
Rebels take over South Sudan oil regions,notclickbait
'Mobile phone dermatitis' linked to nickel deposits,notclickbait
Iran tests new centrifuges,notclickbait
29 Things Non-Germans Find Bewildering About Germany,clickbait
Proton rocket fails to launch AMC-14 satellite,notclickbait
UConn Men Overpower Texas A&M to Reach Round of 16,notclickbait
7 Surprisingly Easy Ways To Get Organized For The Holidays,clickbait
Yankees Grab a Share of First Place as Everyone Lends a Hand,notclickbait
"This Infographic Makes That All-Male ""Vanity Fair"" Photo Even Worse",clickbait
"Dead children found in car in Sussex, UK",notclickbait
Rainy Days in Paradise,notclickbait
Ousted Honduran president Zelaya says coup talks suspended,notclickbait
"What Does It Mean To ""Hook Up"" With Someone",clickbait
Target Customers Were Confused When Porn Played Loudly Over The Intercom,clickbait
Everything You Need To Know About The Sweetest Bakery In London,clickbait
Report finds Canberra and Northern Territory have most expensive cocaine in Australia,notclickbait
250 Feared Dead in Indonesia Ferry Disaster,notclickbait
Who's the richest entertainer in Australia? The Wiggles of course!,notclickbait
ECOWAS suspends Niger in dispute over constitution,notclickbait
Aziz Ansari's New Show Has Its First Trailer And It's Pretty Damn Great,clickbait
"23 Hilarious Hidden Jokes On ""The Simpsons"" You Probably Missed",clickbait
Report: invasion of Iraq provided boost for Al-Qaeda,notclickbait
"People Are Upset That Rey Is Missing From ""Star Wars: The Force Awakens"" Toy Sets",clickbait
"Hey Guys, Ted Mosby Is In India",clickbait
"Calls for aid to help feed millions, as East Africa plunges into drought",notclickbait
"Before Kentucky Derby History Along the Rail, a Partnership Began in a Bar",notclickbait
Malicious Software Is Revised,notclickbait
This 11-Year-Old Girl Started A Project Called #1000BlackGirls To Get More Diverse Books In Schools,clickbait
38 Times Tom Hardy Melted Your Heart With His Love For Dogs,clickbait
Elizabeth II annuls Fred Goodwin knighthood,notclickbait
"Tanker crash kills two in Brevard County, Florida",notclickbait
2015's Biggest Memes Are Now Emojis,clickbait
"Holding On to Wig, Dodgers Market Fallen Star",notclickbait
21 Signs You're Secretly A Real Bitch,clickbait
19 Of The Most Hilarious Tweets About Ryan Gosling,clickbait
Deaths on South African roads at 1215 for December 2005,notclickbait
Gay teachers' status uncertain after Polish election,notclickbait
When You Hate Your BF's Mustache,clickbait
"Dannie Abse hurt, wife killed in car accident",notclickbait
Isle of Man Plans Unlimited Music Downloads,notclickbait
17 Colorado Trails That Should Be On Every Hiker's Bucket List,clickbait
Eurozone now officially in recession,notclickbait
Nigerian sentenced to death for admitting to gay relations,notclickbait
13 Pets Who Don't Understand How Cute They Are,clickbait
"Are You More North, South, Or Central New Jersey",clickbait
Australian wins 2005 World Series of Poker,notclickbait
Texas Tech coach may move to University of Miami,notclickbait
Iran close to decision on nuclear program,notclickbait
Cyclone Kills Nearly 200 in Bangladesh and India,notclickbait
23 Crucial Items Every Die-Hard Tailgater Needs,clickbait
19 Things That Happen When You Get Together With Your Uni Friends,clickbait
Aviation experts suggest Air France Flight 447 broke up in midair,notclickbait
"In China, G.M. Remains a Powerful Player",notclickbait
Media Maelstrom Awaits Alex Rodriguez in Florida,notclickbait
South Koreans Express Fatigue With a Recalcitrant North,notclickbait
An Adorable Animals Advent Calendar: December 21,clickbait
Two arrests made over Croxteth shooting,notclickbait
Chinese City Is Chilly to a Sex Theme Park,notclickbait
13 Reasons Why Taylor Swift's 1989 World Tour Was The Best Part Of 2015,clickbait
Britney Spears 9 Years Ago Vs. Today,clickbait
"39 Of The Most Heartfelt, Relatable And Comforting Quotes And Lyrics About Depression",clickbait
Coors Light Uses Cold to Turn Up Heat on Rivals,notclickbait
What New Song Should Be Your Jam This Weekend,clickbait
Is This Cover Art From A Kanye West Or Coldplay Album,clickbait
"If ""Harry Potter"" Characters Were In ""Game Of Thrones""",clickbait
7 Mental Health Resources For When You're Feeling Helpless,clickbait
"According to UN report, bribes cost Afghans US$2.5 billion per year",notclickbait
"Glasgow, Scotland shooting leaves two hospitalised",notclickbait
We Know Your Favorite Music Genre Based On Your Zodiac Sign,clickbait
15 Awards For Anyone Who Definitely Has What's Going Around,clickbait
"Which Character From ""Mob City"" Are You",clickbait
"After a Week of Travel, Castroneves Has a New Trip",notclickbait
16 Snapchats That Prove DJ Khaled Is The Hero We All Need,clickbait
U.S. Resumes Surveillance Flights Over Pakistan,notclickbait
"Pinned Down, a Sprint to Escape Taliban Zone",notclickbait
Brittany Ray Scores 26 as Rutgers Beats Notre Dame,notclickbait
29 Hilarious Fake Literary Band Names,clickbait
Daring People Try Daring Shots,clickbait
12 Incredible Photos Of An Icelandic Glacier That Will Make You Want To Go There Right Now,clickbait
Pakistan and Taliban Battling for Key City,notclickbait
Surprising Beauty Hacks Using Coffee Grounds,clickbait
McCain and Obama participate in Saddleback Church forum,notclickbait
"Belgian king swears in PM Van Rompuy, cabinet",notclickbait
Chinese version of Wikinews gets blocked in China,notclickbait
Scientists improve cancer research techniques,notclickbait
15 Pieces Of Sushi That Are A Sin Against Nature,clickbait
More Players Coming Out of Africa and Into M.L.S.,notclickbait
17 Ways To Keep Your Kid Safe This Halloween,clickbait
"Adam Driver Is Bringing Emo Kylo Ren Vibes To ""SNL""",clickbait
There's A New Taylor Swift Meme Sweeping Tumblr,clickbait
Ukraine Says 3 Tried to Sell Bomb Material,notclickbait
Deal Is Reached to Keep Boston Sailing Show Afloat,notclickbait
WHO: H1N1 influenza virus still a pandemic,notclickbait
Ross on Wye Friends win gold for garden,notclickbait
British comedian Eddie Izzard completes 43 marathons in 51 days,notclickbait
British Regulator Accuses 3 of Insider Trading,notclickbait
Malaysian Court Orders Reinstatement of Opposition Minister,notclickbait
9 Painfully True SEX-Pectations Vs Reality,clickbait
"First, Third or Outfield, Mets Want Tatis in a Position to Hit",notclickbait
Fats Domino missing in the wake of Hurricane Katrina,notclickbait
Australian Minister 'leaks' draft of anti-terror bill,notclickbait
22 Pictures People Who Are Good Students Will Never Understand,clickbait
Sex Predator Accusations Shake a Wisconsin Town,notclickbait
"This Movie Could Be The Next ""The Room""",clickbait
Guard of Key Witness Killed Before Terror Trial in Greece,notclickbait
Chris Langham found guilty of downloading child pornography,notclickbait
9 Slightly Gross Reasons You Might Want To Leave Your Pubes The Fuck Alone,clickbait
Medtronic Posts 69% Decline in Profit,notclickbait
22 Brutally Honest Confessions From A Veterinarian,clickbait
US political columnist James J. Kilpatrick dies at age 89,notclickbait
Lesbians Watched And Critiqued Lesbian Porn And It Was Traumatic,clickbait
New Zealand pilots receive bravery awards for foiling airliner hijack,notclickbait
13 Struggles Only Pets Who Live In Canada Will Understand,clickbait
"Baby survives after stroller hit by train in Melbourne, Australia",notclickbait
"Sure-Footed, Boonen Captures His 3rd Paris-Roubaix",notclickbait
Move to Redefine New England Fishing,notclickbait
21 Tweets That Are Way Too Funny For Anyone With A Pregnant Sister,clickbait
A Manitoba Photographer Is Selling A Gorgeous Calendar To Help Refugees,clickbait
This Heart Test Will Determine What Kind Of Romantic You Are,clickbait
27 Things Everyone Obsessed With Ikea Will Understand,clickbait
Sondhi may face legal action from Thai Rak Thai party,notclickbait
19 Painful Confessions About Being An Artist,clickbait
OPEC Backs Away From New Output Cuts,notclickbait
What Was The Worst Netflix And Chill You've Experienced,clickbait
Geffen Said to Be Still Interested in The New York Times,notclickbait
Obama budget calls for record US deficit,notclickbait
Gaps Appear in G.O.P. Solidarity,notclickbait
22 Struggles Of People With Zero Athletic Ability,clickbait
Foul Ball Leaves Wright Limping; Hobbled Youkilis Is Out,notclickbait
Can You Identify The Iconic Video Game Character From Just A Color Scheme,clickbait
Macy's flagship store in New York evacuated due to fire,notclickbait
Student on Trial in Italy Claims Police Pressure,notclickbait
"U.S. watchdog group lists ""most corrupt members of Congress""",notclickbait
Couples Who Prove Opposites Attract,clickbait
"Chicago Metra considers selling naming rights for train lines, stations",notclickbait
Obama (as TV Salesman) Pushes Home Refinancing,notclickbait
"Which Character From ""The Good Dinosaur"" Are You",clickbait
Unions battle in Ohio over hospital workers,notclickbait
Europe Looks to Africa for Solar Power,notclickbait
Here's Why You Shouldn't Care About How Damn Cold It Is,clickbait
More Empty Shop Windows in New York,notclickbait
French Find Safety Nets Multiplying in Pastures,notclickbait
Which Cartoon Family Do You Belong In,clickbait
Can You Pass This Gross-Ass Bodily Fluid Quiz,clickbait
Are You Dead,clickbait
13 Annoying Little Problems Trans Women Didn't Expect After Transition,clickbait
13 Things About Language That Will Leave You Speechless,clickbait
We Must Never Forget That Ben Affleck And Hillary Swank Were In The Best Movie Ever,clickbait
Here Are All The Winners At The 2016 BAFTAs,clickbait
"Which ""Friends"" Character Should You Actually Date",clickbait
Adele Said A Mic Dropped In The Piano And That's Why Her Grammy Performance Was Off,clickbait
"Man bites dog, charged with animal cruelty",notclickbait
A Reminder That Maru Is Still King Of The Internet,clickbait
Native Americans Confessed How They Feel About America And It Got Real,clickbait
US Senate offices evacuated,notclickbait
Everything You Need To Know About This Chocolate Cheese Toastie,clickbait
34 Very Important Pictures Of Shia LaBeouf Watching His Own Movies,clickbait
25 Things You Will Only Understand If You Went To College In Texas,clickbait
British Court Finds 3 Not Guilty of Aiding London Bombers,notclickbait
Man charged with murder of British woman in Hong Kong,notclickbait
Hovind's 11th Circuit Court Appeal Denied,notclickbait
The Horrible Truth About Bagels,clickbait
21 Things You Should Actually Do If You Win The Lottery,clickbait
18 Reasons We Don't Want Thanksgiving Break To Be Over,clickbait
Can You Identify The Miyazaki Character By Just Their Eyes,clickbait
11 Robots Who Will Certainly Rise Up To Destroy All Humans,clickbait
Teaching Economics and Pizza Equations,notclickbait
Mets  Extend Winning Streak to Seven,notclickbait
