headline,category
Bringing Order to the Chaos of Notes,notclickbait
13 Pedro Infante Songs To Listen To When You're Drunk AF,clickbait
"Try To Keep Your Chill, But Colin Farrell's Hair Is Turning Daddy Gray",clickbait
Pakistan to Turkey container train service launched,notclickbait
21 Pictures Literally Every Girl Has Taken,clickbait
U.S. Retail Sales Rose in May,notclickbait
Israeli army reoccupies Tulkarem in West Bank,notclickbait
Coldplay's new album hits stores worldwide this week,notclickbait
Health expert: Swine flu outbreak exaggerated by pharmaceutical companies for profits,notclickbait
Wikinews interviews Rich Mann and Kevin Smith of the United States Australian Football League about the upcoming National Championship,notclickbait
American Samoa received eight minutes warning before 2009 tsunami,notclickbait
LGBT Women Share Things They Are Tired Of Hearing In This Powerful Video,clickbait
Venture capital investment in Ireland soars by 35%,notclickbait
"If Social Media Ever Gets You Down, This Pop Song Is For You",clickbait
China executes nine for ethnic riots,notclickbait
"Even Kim Kardashian Wishes The Kanye ""Rolling Stone"" Cover Was Real",clickbait
"Two people killed in aircraft crash in Hampshire, England",notclickbait
Fifteen dead in Mexican car wash shooting,notclickbait
Do You Have The Most Horrifying Cable Company Customer Service Story,clickbait
Robber holds retired NYC police officer at gunpoint during convention,notclickbait
South Korean scientists claim they have cloned pet dog,notclickbait
Deadly virus samples missing in Mexico/Lebanon,notclickbait
19 Things You Probably Never Knew About Nightmares,clickbait
"U.S. Looks at Dropping a Condition for Iran Nuclear Talks, Officials Say",notclickbait
Millions Of People Are In Love With This Elderly Man Waiting At The Airport,clickbait
Fans worldwide queue for new iPhone,notclickbait
17 Tumblr Posts About Yoda Guaranteed To Make You Laugh,clickbait
"Voluntary student unionism bill passes Australian House of Representatives, enters Senate",notclickbait
We Need To Talk About Mariah Carey,clickbait
"In Horse Racing, Pedigree Is Not a Guarantee of Breeding",notclickbait
Tee Times May Keep Some Players Under Rain Clouds,notclickbait
"Asian earthquake toll nears 60,000",notclickbait
You Probably Don't Know The Real Reason Chinese Women Bound Their Feet,clickbait
I Was Added To A Group Chat With Eight Strangers And It Got Incredibly Weird,clickbait
17 Hilarious Tumblr Posts That Will Make You Question Everything You Know About Language,clickbait
How Are You Feeling Right Now,clickbait
27 Things You Need To Up Your Shower Game,clickbait
WHO: Polio reemerging in Africa,notclickbait
Answer These Four Questions And We'll Guess Your Gender,clickbait
23 First Tweets From Famous Authors,clickbait
'Very serious': Chinese government releases corruption report,notclickbait
Second man charged in Lee Rigby murder case,notclickbait
"We Need To Talk About The Music From ""A Goofy Movie""",clickbait
Energy Costs Lift Retail Sales and Producer Prices,notclickbait
Find Out Your Badass Harry Potter Roller Derby Name,clickbait
"The New ""Little Mermaid"" Is Going To Be Blonde And People Aren't Happy",clickbait
Explosion Kills Afghan Police Chief and 3 Officers,notclickbait
People Try Snapchat's New Selfie Filters,clickbait
Over 1.5m apply for British Live 8 tickets,notclickbait
Puerto Rico Ex-Governor Is Acquitted of Graft,notclickbait
19 Signs You're Finally Becoming An Adult,clickbait
British man survives artificial heart transplant,notclickbait
Proposal to Raise Income Tax in Pennsylvania,notclickbait
NATO to expand Afghanistan presence,notclickbait
Killen convicted of manslaughter for 1964 civil rights workers murders,notclickbait
17 Heartbreaking Confessions From People Who Couldn't Love Someone Back,clickbait
Former Japanese prime minister Hashimoto indicated his retirement,notclickbait
Triathlon national championship held in Belgium,notclickbait
Research focuses on orchids mimicking female wasps,notclickbait
4 U.S. Soldiers Killed in Afghanistan,notclickbait
"Ogilvy Lets Lead Dwindle, but Finishes on Top",notclickbait
"Highway bridge in Minneapolis, Minnesota, collapses",notclickbait
"For Poodles, Maintenance of the Highest Order",notclickbait
American pitchman Billy Mays dies at age 50,notclickbait
How Much Do You Actually Know About Gay Sex,clickbait
19 Incredibly Important Reasons You Should Watch The Rugby World Cup,clickbait
"John Kerry criticizes news media, joins call for inquiry on Downing Street Memo",notclickbait
British Airways plans to cut carbon dioxide emissions by 50% by 2050,notclickbait
Scientists proudly display oldest crystal on Earth,notclickbait
"Xenophobia Threatens Italy, President Giorgio Napolitano Warns",notclickbait
Pettitte Meets Prosecutors in Clemens Inquiry,notclickbait
"The ""X-Files"" Cast On When Mulder Fell In Love With Scully",clickbait
High tides sweep west Galveston Bay,notclickbait
Latest Citigroup Rescue May Not Be Its Last,notclickbait
"President Bush of the United States authorized NSA surveillance of citizens, bypassing court warrants",notclickbait
17 Times The Mom On Clarissa Was A Goddamn Style Icon,clickbait
"Should You Marry Lucas Or Nathan Scott From ""One Tree Hill""",clickbait
People Try Bizarre Candy Canes,clickbait
People Are Emptying Out Giant Stuffed Bears And Climbing Inside,clickbait
"Natalie Dormer Auditioned For A Completely Different Role On ""Game Of Thrones""",clickbait
Grenade set off outside Tajik ministry,notclickbait
19 Passive Aggressive Notes That Deserve A Damn Medal,clickbait
16 DJ Khaled Quotes That'll Motivate The Shit Out Of You,clickbait
Joachim to attempt breaking record for static cycling,notclickbait
21 Gifts For People Who Are Completely Obsessed With Tea,clickbait
"Dam Bursts in Indonesia, Killing Dozens in Flood",notclickbait
21 Pictures About Work Guaranteed To Make You Laugh,clickbait
Potterheads Try Fan Created Sweets,clickbait
Taliban in Southern Pakistan Raise U.S. Fears,notclickbait
What Adorable Nickname Should You Give Your Dog,clickbait
Gunman on the loose in Melbourne,notclickbait
MySpace to display AMBER Alerts,notclickbait
"UK home shopping retailer Shop Direct group to cut 1,150 jobs",notclickbait
"Advice in Two New Books, but Not From Talking Heads",notclickbait
Concern about sovereign debt of some EU members roils markets,notclickbait
18 Times James Blunt Took No Shit On Twitter In 2015,clickbait
RTÉ's Eddie Hobbs attracts massive audience,notclickbait
"Schröder gives up German chancellorship ambitions, makes way for Merkel",notclickbait
Apple Inc. doubled its profits,notclickbait
8 Teams Threaten to Splinter From Formula One,notclickbait
"Historic gym the site of Benet Academy, Illinois victory over Oswego",notclickbait
Duke The Disabled Dwarf Bull Who Uses A Wheelchair To Walk Needs A New Home,clickbait
What Does Your Hair Say About You,clickbait
Can We Pickle That,clickbait
Launch of Space Shuttle Discovery further delayed,notclickbait
Stocks Barely Budge as Investors Await New Signals,notclickbait
22 Things Scottish People Have Been Trying To Tell You For Years,clickbait
Lockerbie convict's family among protesters for justice in Edinburgh,notclickbait
Human Error and Management Decisions Faulted in W. Va. Bayer Explosion,notclickbait
I Bet You Can't Identify Each Of These Disney Movies,clickbait
"Reminder That Daniel Radcliffe's ""Harry Potter"" Audition Is Literally The Cutest Thing You'll Ever See",clickbait
Canadian military accused of Agent Orange cover up,notclickbait
Which Early 2000s Disney Show Matches Your Zodiac,clickbait
"Are You More Dipper Or Mabel From ""Gravity Falls""",clickbait
When You're Single For The Holidays,clickbait
US army gives medical assistance to Iraq school,notclickbait
13 Charts That Perfectly Sum Up Having A Big Butt,clickbait
18 Genius Ways To Eat Cheese For Every Meal,clickbait
13 Things All Slytherins Will Need In 2016,clickbait
"There's A New Trailer For The ""Sherlock"" Christmas Special And It's Pure Magic",clickbait
"This Is What It's Like To Eat Durian, The Stinky And Scary King Of Fruits",clickbait
19 Gifts Every Classical Music Nerd Will Love,clickbait
"Here's How To Survive Adulthood, According To Judah Friedlander",clickbait
This Dog Loves Leaves More Than You Love Anything,clickbait
Renault F1 launch criminal complaint against former driver over race-fixing allegation,notclickbait
The One Way To Get A Phone Number,clickbait
Deadly flooding in Pakistan kills hundreds,notclickbait
Priyanka Chopra Just Became The First South-Asian Actress To Win A People's Choice Award,clickbait
North Carolina Beats Radford in First Round Without Lawson,notclickbait
We Need To Talk About Gigi Hadid For Like 10 Seconds,clickbait
"27 ""Scrubs"" Moments That Will Make You Laugh Every Time",clickbait
New Mexico Legislature Passes Caps on Contributions,notclickbait
"Even at Carolina, Penguins Dominate Hurricanes",notclickbait
What Should Your Squad Be For Halloween This Year,clickbait
"Mozambican opposition rejects election results, calls for another vote",notclickbait
Foxconn under pressure after tenth employee suicide this year,notclickbait
"The First ""Grease: Live"" Teaser Is Here And It's Absolutely Electrifying",clickbait
Xbox 360 shortages expected on debut day in Europe,notclickbait
26 Beauty Products Our Readers Loved In 2015,clickbait
"Which Hogwarts Houses Do These ""American Horror Story"" Characters Belong In",clickbait
Which Pop Artist/Producer Duo Are You,clickbait
GigaPan Automates the Panoramic Picture,notclickbait
"18 Insanely Cute Gifts You Should Buy ""Your Person"" Immediately",clickbait
Apple swamped by iPhone 4 pre-orders,notclickbait
The Simpsons episode to premiere on Sky1,notclickbait
"19 GIFs That Will Make You Say ""Ahhhhhhh""",clickbait
"Reminder That Chad From ""High School Musical"" Is All Grown-Up",clickbait
What Your Co-Workers On Facebook Need To Hear,clickbait
Family and Lawyer Fear for Reporter Who Threw His Shoes at Bush,notclickbait
Watch This Woman Style A Hijab In 7 Easy Ways,clickbait
34 Non-American Musicians You Need To Add To Your Playlist,clickbait
21 Ways To Cover Your Home With Pictures Of Your Own Cat,clickbait
Airline bombing suspect spent months in Yemen,notclickbait
Stock markets worldwide continue to fall,notclickbait
68 pieces of luggage found behind Texas pet store,notclickbait
34 Cosplayers Who Slayed MCM London Comic Con 2015,clickbait
Volcanic activity expands McDonald Island off Australia,notclickbait
Jailed former Taiwanese President on hunger strike,notclickbait
How Much Do You REALLY Know About Cake,clickbait
23 Bizarre Beauty Trends From Yesteryear,clickbait
How A Gay Porn Star And Rapper Became Vine Famous And Then Liveblogged His Arrest On Facebook,clickbait
Egyptian military appoints committee to amend constitution,notclickbait
17 Photos That'll Remind You That The World Isn't All Bad,clickbait
3 Refugees Living In The UK Cook Their Favourite Meals From Home,clickbait
G8 finance ministers agree on deal to relieve debts of 18 poorest nations,notclickbait
"Former Ukraine PM Yulia Tymoshenko to end hunger strike, daughter announces",notclickbait
"Can You Guess The ""Friends"" Season Based On Joey's Fridge",clickbait
Australian Dollar reaches a 27 year high,notclickbait
Here's A GIF That Perfectly Captures Joke-Stealing On Twitter,clickbait
24 Things You Can Sympathise With If You've Ever Been Broke In London,clickbait
29 Faces You'll Immediately Recognize If You've Ever Been To The Gyno,clickbait
Protesters Defy Iranian Efforts to Cloak Unrest,notclickbait
A Black Woman Walks Into A Gun Show,clickbait
The One Tip That Will Help Guys Dress Better For The Rest Of Their Lives,clickbait
23 Things That Could Only Happen In San Francisco,clickbait
"Explosion at new shopping centre in Bath, United Kingdom",notclickbait
France Looks to Help Airbus With Loan Guarantees,notclickbait
21 Recipes That Will Completely Transform Boring Leftovers,clickbait
8 Songs That Will Make You See Kesha In A New Light,clickbait
Zenit rocket launches Galaxy 18 satellite,notclickbait
19 Insanely Cute Trays That Will Help Keep Your Things Organized,clickbait
It's Time For You To Make A Snap Decision: NYC Or LA,clickbait
"Big Brown victorious in Kentucky Derby, runner-up Eight Belles breaks down",notclickbait
"This Is The Hardest ""Divergent"" Quiz You'll Ever Take",clickbait
Can We Guess Which Kardashian/Jenner Sister Is Your Favorite Based On Three Questions,clickbait
If Siri Were A Real Personal Assistant,clickbait
15 Hilarious Tweets About Narendra Modi Hanging Out With Francois Hollande,clickbait
19 Ideas So Bad Only The Internet Could Love Them,clickbait
UConn Stifles Louisville In a Flash,notclickbait
Mexican Data Show Migration to U.S. in Decline,notclickbait
Cool front to bring lasting relief for Texas,notclickbait
2008 Taipei AMPA: IT industry will pulse the growth of automotive industry,notclickbait
Honduran President Is Ousted in Coup,notclickbait
KJ Noons stripped of EliteXC Lightweight Title,notclickbait
1 Trip To Trader Joe's + $20 = 5 Easy Vegan Dinners,clickbait
"Its Muscle Car Glory Faded, Pontiac Shrivels Up",notclickbait
22 Sentences That Are Way Too Real For People Who Grew Up With Strict Parents,clickbait
Many Gulls Die After Oil Spills Into River in Ohio,notclickbait
21 Crazy Things People Have Actually Witnessed At Disney,clickbait
"18 Gorgeous Santas That'll Make You Wanna Say ""Ho, Ho, Ho""",clickbait
Justice Dept. Backs Saudi Royal Family on 9/11 Lawsuit,notclickbait
"Definitive Proof ""Titanic"" And ""Peter Pan"" Are Almost The Same Movie",clickbait
23 People Who Failed Spectacularly At Cooking,clickbait
Which Dog Breed Are You Based On Your Zodiac Sign,clickbait
"All 78 ""Treehouse Of Horror"" Segments Ranked From Worst To Best",clickbait
"HiNet, WCG, and WGT unite holding Taiwanese Gaming Athletes' Qualification",notclickbait
Rocket carrying NASA carbon dioxide satellite crashes into ocean,notclickbait
Off to Practice Before a Round of Golf? Think Again,notclickbait
Thai PM sues newspaper for 500 million baht,notclickbait
Opera singer Pavarotti in serious condition,notclickbait
"Central Michigan quarterback sets passing record, becomes finalist for award",notclickbait
18 Deliciously Decadent Lemon Desserts To Die For,clickbait
Shares worldwide surge due to US government plan,notclickbait
You Definitely Need To Be Following January Jones On Instagram,clickbait
For Anyone Who's Had A Huge Fight With Family Over Data,clickbait
"Zoo elephants live shorter lives than their wild counterparts, report warns",notclickbait
Chinese Golfer Makes a Name for Herself on L.P.G.A. Tour,notclickbait
Australia First begins revival campaign,notclickbait
Which TV Character Alter Ego Are You,clickbait
11 Horrifyingly Cute Halloween Emojis,clickbait
Afghan Insurgents Expand Their Use of Increasingly Sophisticated Homemade Bombs,notclickbait
Violence erupts in Guadeloupe after labor dispute,notclickbait
First Active offer 100% mortgages in Ireland,notclickbait
Find Out What You Should Watch On Netflix This November,clickbait
Rep. Waxman: Karl Rove violated non-disclosure agreement,notclickbait
"Dennis Ritchie, C programming language creator, dies aged 70",notclickbait
"In Recession, Strategy Shifts for Big Chains",notclickbait
Gwanda Chakuamba freed by Malawi court,notclickbait
"24 Reasons To Start Watching ""Vicious"" Right Now",clickbait
"Rail explosion reported at Viareggio, Italy",notclickbait
Can You Match The Quote To The Kardashian Who Said It,clickbait
17 Incredibly Important Life Lessons We Can Learn From Winona Ryder,clickbait
Wikinews interviews Daylight Saving for South East Queensland Party about the upcoming Queensland State election,notclickbait
French Montana Wearing Slippers On The Beach Will Make You Feel Uncomfortable,clickbait
"Do You Know These Secondary ""Game Of Thrones"" Characters",clickbait
17 Faces That Perfectly Sum Up Every Black Girl's Transition From Relaxed To Natural Hair,clickbait
"You Need To Watch 5,000 Ducklings Run Into A Pond Right Now",clickbait
Please Help Us Figure Out What These Carrie Fisher Tweets Mean,clickbait
"The ABCs According To ""Friends""",clickbait
How Much Do You Actually Know About Cooking,clickbait
China successfully launches Shenzhou VI manned rocket,notclickbait
This Mattress Has A Built-In Pet Bed Because The Snuggle Is Real,clickbait
You Won't Be Able To Stop Watching This Mesmerising Rangoli Video,clickbait
What's SO Great About YOUR Life,clickbait
"F#@k, Marry, Kill: The ""Divergent"" Edition",clickbait
Canadian PM will shuffle cabinet today,notclickbait
Regulator bans UK video-on-demand service,notclickbait
16 Things Dudes Need To Stop Wearing In 2016,clickbait
Are These Smiths Lyrics Real Or Fake,clickbait
We Know Your Favorite Disney Dude Based On Your Zodiac Sign,clickbait
Ex-Lehman Trader Guilty of Fraud Charges,notclickbait
Southern Ocean whale slaughter to resume,notclickbait
Body of Rosa Parks to lie in honor at U.S. Capitol,notclickbait
Agency Skeptical of Internet Privacy Policies,notclickbait
Artists Made These Heartbreaking Posters As Tribute To Child Victims Of The Peshawar School Attack,clickbait
"Do You Remember The Words To ""You're The One That I Want""",clickbait
Teaching Intelligent Design: Incumbent Dover PA school board fails reelection,notclickbait
"18 Things ""Back To The Future"" Forgot To Predict",clickbait
Massachusetts study finds links between bullying and family violence,notclickbait
"Do You Actually Remember The First Episode Of ""The West Wing""",clickbait
War Hero in Vietnam Forces Government to Listen,notclickbait
Microsoft extends warranty for all Xbox 360s,notclickbait
"Suspect in eight murders arrested in Illinois, United States",notclickbait
Russian polar submarine TV footage faked,notclickbait
31 Hilarious Times Tumblr Explained Our Weird Brains,clickbait
"We Know Your Favorite ""Harry Potter"" Character Based On Your Favorite Puppy",clickbait
18 Times Dylan Sprouse Was The Absolute Best Person On Twitter,clickbait
17 Pictures Short Girls Will Never Understand,clickbait
Multiple deaths as Congolese government cracks down on pro-democracy protests,notclickbait
"If You Liked ""Uptown Funk,"" You'll Love This Song",clickbait
Fifteen flu sufferers die in Wales in one week,notclickbait
"I Let Twitter Run My Life For A Day, And Here's What Happened",clickbait
Path to the Supreme Court: Speak Capably but Say Little,notclickbait
US Senator Kennedy has brain tumor surgically removed,notclickbait
This Pastry Chef Matches His Treats To His Outfit And It Works,clickbait
This Is The Best Way To Netflix And Chill,clickbait
Cher Destroys Donald Trump In One Little Tweet,clickbait
2008 Taiwan Tourism Exposition to encourage tourism industry after Sichuan earthquake,notclickbait
Obama Reverses Rules on U.S. Abortion Aid,notclickbait
"Last Gaza settlement cleared, West Bank towns prepare to resist",notclickbait
These Inspiring Portraits Capture The Emotional Fight Against Cancer,clickbait
Final draw sets groups for FIFA World Cup 2010,notclickbait
South African sprinter Philip Rabinowitz dies at age 104,notclickbait
19 Tips To Make Your Bed Even More Cozy,clickbait
Are These Women More Than Just Friends,clickbait
Co-Workers Surprise Each Other With Compliments,clickbait
Irish Government sends team of officials in hunt for Journalist,notclickbait
Hong Kong 'tutor king' applies for bankruptcy,notclickbait
Are These Pills Grey Or Red And Blue,clickbait
Drop Everything: Psy Released Two Insane New Music Videos,clickbait
"After Season in Flux, Knicks See Stability in Their Future",notclickbait
Can You Guess The Artist Based On Their Hit Album Cover Art,clickbait
NASA: Old Arctic sea ice continues to melt,notclickbait
Isn't She Lovely,clickbait
US indicts eleven alleged pirates from Somalia,notclickbait
China launches major cleanup operation after oil spill,notclickbait
"Rangers Shut Out Devils, Assisted by Avery",notclickbait
Can You Guess The Lana Del Rey Music Video From The Screenshot,clickbait
23 Words That Mean Something Completely Different When You Get Engaged,clickbait
40 Thoughts Everyone Has When It Starts Raining Outside,clickbait
Obama Embarks on His Honeymoon. The Question: How Long Will It Last?,notclickbait
Iraqi Policemen to Face Charges of Prison Abuse,notclickbait
Emily Blunt Is Not A Fan Of John Krasinski's Hot New Bod,clickbait
17 Things You Should Know Before Going Vegan,clickbait
"17 Incredible ""Degrassi"" Fashion Moments",clickbait
"Here's How To Play ""Fallout 4"" As Imperator Furiosa",clickbait
Mobile phones to help fight AIDS in Africa,notclickbait
2007 German League Cup: Bayern Munich wins 6th League Cup,notclickbait
"In Gaza, the Wait to Rebuild Lingers",notclickbait
Senior Aide to Hussein Sentenced to 15 Years,notclickbait
Zenit rocket explodes on launch pad,notclickbait
You've Been Making Pancakes Wrong Your Entire Life,clickbait
Talk-therapy can make a difference in early treatment of severe depression,notclickbait
"As Italy prepares for new government, shots fired near prime minister's office",notclickbait
22 Hair Color Ideas For When You Can't Pick Just One,clickbait
13 Awkward Moments That Happen When You Get Braces,clickbait
Southwest Air to Begin Flying From Boston,notclickbait
New findings suggest AIG executive bonuses were larger than previously thought,notclickbait
Five Jet Crew Members Have Been Suspended For Allowing Sonu Nigam To Sing On A Flight,clickbait
'Bloody Sunday Inquiry' publishes report into British Army killing of activists in Northern Ireland,notclickbait
"Small explosion investigated in Times Square, New York",notclickbait
Sprint/RealNetworks to provide cell phone Internet radio and podcasts in US,notclickbait
Toronto transit union threatens strike for Monday,notclickbait
This Dog Riding A Bike With A Helmet On Is The Cutest Damn Thing You'll See All Day,clickbait
"As Giro Nears End, Contador Watch Starts",notclickbait
17 Ways To Be The Email Sender You Want To See In The World,clickbait
Which Iconic '00s Teen Movie Do You Actually Belong In,clickbait
Black Friday Is Your Chance To Get The Naked Palettes On Sale,clickbait
Can You Identify The Valentine's Chocolates (Without Tasting Them),clickbait
A More Assertive Donovan Drives U.S. Soccer Ambitions,notclickbait
"2 Churches, Black and White, See Inaugural Hope",notclickbait
11 Classic Movie Lines From Alan Rickman,clickbait
Civilians dead following U.S. air strike on 'terrorist compound',notclickbait
We Invaded Three Queer Lady Couple's Apartments To See What It's Like After The U-Haul,clickbait
"Bernie Sanders Played His Own Ancestor Alongside Larry David On ""SNL""",clickbait
"Nortel to Cut Another 3,200 Jobs",notclickbait
U.S. force-feeding Guantanamo hunger strikers,notclickbait
Sarkozy and Merkel Try to Shape European Unity,notclickbait
22 Secrets Hotel Breakfast Waiters Are Supposed To Keep,clickbait
What Gift Should You Buy Your Favorite Geek,clickbait
"18 Times ""House M.D."" Got Way, Way Too Real",clickbait
David Beckham Just Got Romeo The Best Birthday Present,clickbait
New prince is born in Norway,notclickbait
"Florida Speaker Steps Down, Citing Corruption Investigation",notclickbait
19 Insane Milkshake Shops Around The World You Need To Eat At,clickbait
Golfer Tiger Woods delivers apology speech,notclickbait
Southern Minnesota plane crash kills eight,notclickbait
Rural African school goes to Sweden for environment award,notclickbait
15 Times Calvin And Hobbes Reminded You To Never Stop Exploring,clickbait
How Dad Is Your Dad,clickbait
Putting U.S. Trucking on a Diet,notclickbait
"Covered Up, and Harassed, in Cairo",notclickbait
"The First ""Hunger Games"" Red Carpet Vs. The Last",clickbait
Are You More Furiosa Or Rey,clickbait
"Swine Flu Vaccine May Be Months Away, Experts Say",notclickbait
27 Wonderfully Geeky Products You Never Knew Your Kitchen Needed,clickbait
North Korea Says Journalists Admitted Crimes,notclickbait
Homage to Chilean politician Jaime Guzmán nineteen years after his death,notclickbait
Large earthquake hits central China,notclickbait
"Thoughts I Had While Watching The Season 11 Premiere Of ""Keeping Up With The Kardashians",clickbait
18 Gordon Ramsay Insults All Servers Really Fucking Need,clickbait
Iran to Begin Tests at Nuclear Station,notclickbait
Obama Again Raises Estimate of Jobs His Stimulus Plan Will Create or Save,notclickbait
Congress Passes Bill to Tighten Weapons Programs,notclickbait
We Know Your Personality And Age Based On Your Favorite TV Show,clickbait
Howard's 10 year party gatecrashed,notclickbait
Watch This Seahorse Shoot Baby Seahorses Out Of Its Stomach,clickbait
Manchester City agree big money for Shaun Wright-Phillips to move to Chelsea FC,notclickbait
Little Rock Nine member Jefferson Thomas dies aged 67,notclickbait
The 45 Funniest Tweets From 2015,clickbait
U.S. fighter jet crashes in Libya,notclickbait
Fighting Around Afghanistan Leaves 50 Dead,notclickbait
Islamabad on red alert for possible terrorist attack,notclickbait
Pakistan arrests 35 people suspected in US soldiers' death,notclickbait
Russia Ends Operations in Chechnya,notclickbait
The Popular Newsweekly Becomes a Lonely Category,notclickbait
Confirmed bird flu death in Nigeria,notclickbait
WHO director: Pandemic alert level will not be raised,notclickbait
13 Reasons Urinals Are The Worst Human Invention Of All Time,clickbait
Israeli Defense Force admits to targeting media center in Gaza City airstrike,notclickbait
24 Things You'll Understand If You Think Working Out Is The Worst,clickbait
21 Minimalist Ways To Store Everything In Your Home,clickbait
17 Ridiculous Texts All Siblings Have Sent To Each Other,clickbait
The Hardest Tube Station Quiz You'll Take Today,clickbait
Slow Cooker Mexican Dishes,clickbait
These Pretzel Bites Are Dippable AF,clickbait
"Nortel, Once a Telecom Giant, Files for Bankruptcy",notclickbait
